ID,Question,Answer,Category,Source_URLs
313,DS Bratniak-Muszelka address?,"Grójecka 39, 02-031 Warsaw, 22 234 44 70 Sources: https://sspw.pl/wp-content/uploads/2024/10/Arrival_info_Pack_2024_WUT.pdf",Accommodation & Housing,https://sspw.pl/wp-content/uploads/2024/10/Arrival_info_Pack_2024_WUT.pdf
314,DS Mikrus address?,"Waryńskiego 10, 00-631 Warsaw, 22 234 98 61 Sources: https://sspw.pl/wp-content/uploads/2024/10/Arrival_info_Pack_2024_WUT.pdf",Accommodation & Housing,https://sspw.pl/wp-content/uploads/2024/10/Arrival_info_Pack_2024_WUT.pdf
315,DS Riviera address?,"Waryńskiego 12, 00-631 Warsaw, 22 234 98 81 Sources: https://sspw.pl/wp-content/uploads/2024/10/Arrival_info_Pack_2024_WUT.pdf",Accommodation & Housing,https://sspw.pl/wp-content/uploads/2024/10/Arrival_info_Pack_2024_WUT.pdf
316,DS Żaczek address?,"Wołoska 141a, 02-507 Warsaw, 22 234 88 88 Sources: https://sspw.pl/wp-content/uploads/2024/10/Arrival_info_Pack_2024_WUT.pdf",Accommodation & Housing,https://sspw.pl/wp-content/uploads/2024/10/Arrival_info_Pack_2024_WUT.pdf
317,DS Pineska-Tulipan address?,"Uniwersytecka 5, 02-036 Warsaw, 22 234 42 01 Sources: https://sspw.pl/wp-content/uploads/2024/10/Arrival_info_Pack_2024_WUT.pdf",Accommodation & Housing,https://sspw.pl/wp-content/uploads/2024/10/Arrival_info_Pack_2024_WUT.pdf
318,DS Ustronie address?,"Księcia Janusza 39, 01-452 Warsaw, 22 234 31 01 Sources: https://sspw.pl/wp-content/uploads/2024/10/Arrival_info_Pack_2024_WUT.pdf",Accommodation & Housing,https://sspw.pl/wp-content/uploads/2024/10/Arrival_info_Pack_2024_WUT.pdf
319,DS Tatrzańska address?,"Tatrzańska 7a, 00-742 Warsaw, 22 234 34 05 Sources: https://sspw.pl/wp-content/uploads/2024/10/Arrival_info_Pack_2024_WUT.pdf",Accommodation & Housing,https://sspw.pl/wp-content/uploads/2024/10/Arrival_info_Pack_2024_WUT.pdf
320,DS Babilon address?,"Kopińska 12/16, 02-321 Warsaw, 22 234 40 03 Sources: https://sspw.pl/wp-content/uploads/2024/10/Arrival_info_Pack_2024_WUT.pdf",Accommodation & Housing,https://sspw.pl/wp-content/uploads/2024/10/Arrival_info_Pack_2024_WUT.pdf
321,What to bring to dormitory?,"Check with specific dormitory for list Sources: https://sspw.pl/wp-content/uploads/2024/10/Arrival_info_Pack_2024_WUT.pdf",Accommodation & Housing,https://sspw.pl/wp-content/uploads/2024/10/Arrival_info_Pack_2024_WUT.pdf
322,Dormitory application deadline?,"Check ESKS for current round deadlines Sources: https://esks.pw.edu.pl/en/",Accommodation & Housing,https://esks.pw.edu.pl/en/
323,Dormitory room types?,"Single, double, or shared rooms depending on facility Sources: https://sspw.pl/wp-content/uploads/2024/10/Arrival_info_Pack_2024_WUT.pdf",Accommodation & Housing,https://sspw.pl/wp-content/uploads/2024/10/Arrival_info_Pack_2024_WUT.pdf
324,Kitchen facilities?,"Shared kitchens in most dormitories Sources: https://sspw.pl/wp-content/uploads/2024/10/Arrival_info_Pack_2024_WUT.pdf",Accommodation & Housing,https://sspw.pl/wp-content/uploads/2024/10/Arrival_info_Pack_2024_WUT.pdf
325,Laundry in dormitories?,"Available, may require payment Sources: https://sspw.pl/wp-content/uploads/2024/10/Arrival_info_Pack_2024_WUT.pdf",Accommodation & Housing,https://sspw.pl/wp-content/uploads/2024/10/Arrival_info_Pack_2024_WUT.pdf
326,Internet in dorms?,"WiFi available in all dormitories Sources: https://sspw.pl/wp-content/uploads/2024/10/Arrival_info_Pack_2024_WUT.pdf",Accommodation & Housing,https://sspw.pl/wp-content/uploads/2024/10/Arrival_info_Pack_2024_WUT.pdf
327,Dormitory security?,"24/7 security and reception Sources: https://sspw.pl/wp-content/uploads/2024/10/Arrival_info_Pack_2024_WUT.pdf",Accommodation & Housing,https://sspw.pl/wp-content/uploads/2024/10/Arrival_info_Pack_2024_WUT.pdf
328,Visitors allowed?,"Rules vary by dormitory Sources: https://sspw.pl/wp-content/uploads/2024/10/Arrival_info_Pack_2024_WUT.pdf",Accommodation & Housing,https://sspw.pl/wp-content/uploads/2024/10/Arrival_info_Pack_2024_WUT.pdf
329,Dormitory fees?,"Paid through university accounting system Sources: https://sspw.pl/wp-content/uploads/2024/10/Arrival_info_Pack_2024_WUT.pdf",Accommodation & Housing,https://sspw.pl/wp-content/uploads/2024/10/Arrival_info_Pack_2024_WUT.pdf
330,Dormitory deposit?,"May be required, check specific dorm Sources: https://sspw.pl/wp-content/uploads/2024/10/Arrival_info_Pack_2024_WUT.pdf",Accommodation & Housing,https://sspw.pl/wp-content/uploads/2024/10/Arrival_info_Pack_2024_WUT.pdf
331,Cancel dormitory reservation?,"Contact Accommodation Committee Sources: https://esks.pw.edu.pl/en/",Accommodation & Housing,https://esks.pw.edu.pl/en/
332,Change dormitory room?,"Possible, apply through ESKS Sources: https://esks.pw.edu.pl/en/",Accommodation & Housing,https://esks.pw.edu.pl/en/
333,Summer accommodation?,"Must extend, limited availability Sources: https://sspw.pl/wp-content/uploads/2024/10/Arrival_info_Pack_2024_WUT.pdf",Accommodation & Housing,https://sspw.pl/wp-content/uploads/2024/10/Arrival_info_Pack_2024_WUT.pdf
334,Couples accommodation?,"Check availability with Committee Sources: https://esks.pw.edu.pl/en/",Accommodation & Housing,https://esks.pw.edu.pl/en/
335,Family accommodation?,"Limited, contact Committee Sources: https://esks.pw.edu.pl/en/",Accommodation & Housing,https://esks.pw.edu.pl/en/
336,Dormitory maintenance issues?,"Report to dormitory administration Sources: https://sspw.pl/wp-content/uploads/2024/10/Arrival_info_Pack_2024_WUT.pdf",Accommodation & Housing,https://sspw.pl/wp-content/uploads/2024/10/Arrival_info_Pack_2024_WUT.pdf
337,Private accommodation help?,"ESN and student groups may help Sources: https://sspw.pl/wp-content/uploads/2024/10/Arrival_info_Pack_2024_WUT.pdf",Accommodation & Housing,https://sspw.pl/wp-content/uploads/2024/10/Arrival_info_Pack_2024_WUT.pdf
338,Rental agreements in Warsaw?,"Standard lease, usually 1 year Sources: https://qogentglobal.com/study-in-poland/post-arrival/city-registration",Accommodation & Housing,https://qogentglobal.com/study-in-poland/post-arrival/city-registration
339,Average rent in Warsaw?,"Varies widely by location and size Sources: https://sspw.pl/wp-content/uploads/2024/10/Arrival_info_Pack_2024_WUT.pdf",Accommodation & Housing,https://sspw.pl/wp-content/uploads/2024/10/Arrival_info_Pack_2024_WUT.pdf
340,Utilities included?,"Depends on rental agreement Sources: https://welcome.uw.edu.pl/how-to-get-student-mobility-instruction/",Accommodation & Housing,https://welcome.uw.edu.pl/how-to-get-student-mobility-instruction/
341,Meldunek for dormitory?,"Required, dormitory helps with registration Sources: https://loginlublin.pl/en/registration-of-a-foreigner-meldunek/",Accommodation & Housing,https://loginlublin.pl/en/registration-of-a-foreigner-meldunek/
342,Meldunek for private flat?,"Owner must provide confirmation Sources: https://qogentglobal.com/study-in-poland/post-arrival/city-registration",Accommodation & Housing,https://qogentglobal.com/study-in-poland/post-arrival/city-registration
343,Housing scams?,"Use trusted sources, check agreements carefully Sources: https://sspw.pl/wp-content/uploads/2024/10/Arrival_info_Pack_2024_WUT.pdf",Accommodation & Housing,https://sspw.pl/wp-content/uploads/2024/10/Arrival_info_Pack_2024_WUT.pdf
344,Finding roommates?,"Through student groups and ESN Sources: https://sspw.pl/wp-content/uploads/2024/10/Arrival_info_Pack_2024_WUT.pdf",Accommodation & Housing,https://sspw.pl/wp-content/uploads/2024/10/Arrival_info_Pack_2024_WUT.pdf
345,Short-term housing?,"Hostels, Airbnb, or dormitory if available Sources: https://qogentglobal.com/study-in-poland/post-arrival/city-registration",Accommodation & Housing,https://qogentglobal.com/study-in-poland/post-arrival/city-registration
346,Housing near campus?,"Ochota and Mokotów districts closest Sources: https://sspw.pl/wp-content/uploads/2024/10/Arrival_info_Pack_2024_WUT.pdf",Accommodation & Housing,https://sspw.pl/wp-content/uploads/2024/10/Arrival_info_Pack_2024_WUT.pdf
347,Public transport from dorms?,"All dorms accessible by public transport Sources: https://sspw.pl/wp-content/uploads/2024/10/Arrival_info_Pack_2024_WUT.pdf",Accommodation & Housing,https://sspw.pl/wp-content/uploads/2024/10/Arrival_info_Pack_2024_WUT.pdf
348,Dormitory contracts?,"Through ESKS system Sources: https://esks.pw.edu.pl/en/",Accommodation & Housing,https://esks.pw.edu.pl/en/
349,Early termination penalty?,"Check dormitory contract terms Sources: https://esks.pw.edu.pl/en/",Accommodation & Housing,https://esks.pw.edu.pl/en/
350,Subletting dormitory?,"Generally not allowed Sources: https://esks.pw.edu.pl/en/",Accommodation & Housing,https://esks.pw.edu.pl/en/
351,EU students need visa?,"No, just ID/passport Sources: https://admission.sum.edu.pl/immigration-rules/",Visa & Immigration,https://admission.sum.edu.pl/immigration-rules/
352,Non-EU students visa type?,"National visa (D-type) for studies Sources: https://admission.sum.edu.pl/immigration-rules/",Visa & Immigration,https://admission.sum.edu.pl/immigration-rules/
353,Apply for student visa?,"At Polish consulate/embassy in your country Sources: https://admission.sum.edu.pl/immigration-rules/",Visa & Immigration,https://admission.sum.edu.pl/immigration-rules/
354,Documents for visa?,"Acceptance letter, financial proof, health insurance, accommodation Sources: https://admission.sum.edu.pl/immigration-rules/",Visa & Immigration,https://admission.sum.edu.pl/immigration-rules/
355,Visa processing time?,"30-60 days typically Sources: https://uczelnia.akademiata.pl/en/recruitment-process-for-wseiz/recruitment-for-international-students/",Visa & Immigration,https://uczelnia.akademiata.pl/en/recruitment-process-for-wseiz/recruitment-for-international-students/
356,Residence permit vs visa?,"Permit allows longer stay, visa temporary Sources: https://admission.sum.edu.pl/immigration-rules/",Visa & Immigration,https://admission.sum.edu.pl/immigration-rules/
357,When apply for residence permit?,"Before visa expires, preferably 45 days before Sources: https://admission.sum.edu.pl/immigration-rules/",Visa & Immigration,https://admission.sum.edu.pl/immigration-rules/
358,Residence permit duration?,"Up to 3 years for studies, first usually 15 months Sources: https://admission.sum.edu.pl/immigration-rules/",Visa & Immigration,https://admission.sum.edu.pl/immigration-rules/
359,Residence permit documents?,"Application, passport, acceptance, health insurance, funds proof Sources: https://admission.sum.edu.pl/immigration-rules/",Visa & Immigration,https://admission.sum.edu.pl/immigration-rules/
360,Where apply for residence permit?,"Mazowiecki Voivodeship Office Sources: https://admission.sum.edu.pl/immigration-rules/",Visa & Immigration,https://admission.sum.edu.pl/immigration-rules/
361,Residence permit fee?,"Check Voivodeship Office for current fee Sources: https://cudzoziemiec.bydgoszcz.pl/en/stay-in-poland/temporary-stay/student/",Visa & Immigration,https://cudzoziemiec.bydgoszcz.pl/en/stay-in-poland/temporary-stay/student/
362,Travel during permit application?,"Wait for decision before leaving Poland Sources: https://international.uni.wroc.pl/en/admission-full-degree-studies/useful-information-full-degree-students",Visa & Immigration,https://international.uni.wroc.pl/en/admission-full-degree-studies/useful-information-full-degree-students
363,Residence card collection?,"From Voivodeship Office after approval Sources: https://admission.sum.edu.pl/immigration-rules/",Visa & Immigration,https://admission.sum.edu.pl/immigration-rules/
364,Renew residence permit?,"Yes, apply before expiry Sources: https://admission.sum.edu.pl/immigration-rules/",Visa & Immigration,https://admission.sum.edu.pl/immigration-rules/
365,Student mobility option?,"For EU residence permit holders studying in Poland Sources: https://welcome.uw.edu.pl/how-to-get-student-mobility-instruction/",Visa & Immigration,https://welcome.uw.edu.pl/how-to-get-student-mobility-instruction/
366,Meldunek required?,"Yes, within 30 days for stays over 30 days Sources: https://sspw.pl/wp-content/uploads/2024/10/Arrival_info_Pack_2024_WUT.pdf",Visa & Immigration,https://sspw.pl/wp-content/uploads/2024/10/Arrival_info_Pack_2024_WUT.pdf
367,Where register meldunek?,"District Office (Urząd Dzielnicy) for your address Sources: https://sspw.pl/wp-content/uploads/2024/10/Arrival_info_Pack_2024_WUT.pdf",Visa & Immigration,https://sspw.pl/wp-content/uploads/2024/10/Arrival_info_Pack_2024_WUT.pdf
368,Meldunek documents?,"Passport, visa/permit, accommodation proof Sources: https://sspw.pl/wp-content/uploads/2024/10/Arrival_info_Pack_2024_WUT.pdf",Visa & Immigration,https://sspw.pl/wp-content/uploads/2024/10/Arrival_info_Pack_2024_WUT.pdf
369,Meldunek cost?,"Free of charge Sources: https://loginlublin.pl/en/registration-of-a-foreigner-meldunek/",Visa & Immigration,https://loginlublin.pl/en/registration-of-a-foreigner-meldunek/
370,Mokotów District Office?,"Rakowiecka 25/27 Sources: https://sspw.pl/wp-content/uploads/2024/10/Arrival_info_Pack_2024_WUT.pdf",Visa & Immigration,https://sspw.pl/wp-content/uploads/2024/10/Arrival_info_Pack_2024_WUT.pdf
371,Ochota District Office?,"Grójecka 17a Sources: https://sspw.pl/wp-content/uploads/2024/10/Arrival_info_Pack_2024_WUT.pdf",Visa & Immigration,https://sspw.pl/wp-content/uploads/2024/10/Arrival_info_Pack_2024_WUT.pdf
372,Meldunek for dormitory?,"Dormitory manager signs registration form Sources: https://loginlublin.pl/en/registration-of-a-foreigner-meldunek/",Visa & Immigration,https://loginlublin.pl/en/registration-of-a-foreigner-meldunek/
373,Change address registration?,"Register new address within 30 days Sources: https://qogentglobal.com/study-in-poland/post-arrival/city-registration",Visa & Immigration,https://qogentglobal.com/study-in-poland/post-arrival/city-registration
374,Penalty for late meldunek?,"Administrative fines possible Sources: https://qogentglobal.com/study-in-poland/post-arrival/city-registration",Visa & Immigration,https://qogentglobal.com/study-in-poland/post-arrival/city-registration
375,PESEL number needed?,"Useful, obtained during meldunek registration Sources: https://welcome.uw.edu.pl/during-your-stay/registration-of-address/",Visa & Immigration,https://welcome.uw.edu.pl/during-your-stay/registration-of-address/
376,Work permit for students?,"Depends on nationality and permit type Sources: https://www.sjo.pw.edu.pl/wut/participants/faq/",Visa & Immigration,https://www.sjo.pw.edu.pl/wut/participants/faq/
377,Schengen travel with student visa?,"Limited, Poland must be first entry Sources: https://international.uni.wroc.pl/en/admission-full-degree-studies/useful-information-full-degree-students",Visa & Immigration,https://international.uni.wroc.pl/en/admission-full-degree-studies/useful-information-full-degree-students
378,Karta Pobytu benefits?,"No visa needed for re-entry to Poland Sources: https://international.uni.wroc.pl/en/admission-full-degree-studies/useful-information-full-degree-students",Visa & Immigration,https://international.uni.wroc.pl/en/admission-full-degree-studies/useful-information-full-degree-students
379,Lost passport during studies?,"Contact embassy and university immediately Sources: https://international.uni.wroc.pl/en/admission-full-degree-studies/useful-information-full-degree-students",Visa & Immigration,https://international.uni.wroc.pl/en/admission-full-degree-studies/useful-information-full-degree-students
380,Visa extension in Poland?,"Only force majeure cases Sources: https://international.uni.wroc.pl/en/admission-full-degree-studies/useful-information-full-degree-students",Visa & Immigration,https://international.uni.wroc.pl/en/admission-full-degree-studies/useful-information-full-degree-students
381,Multiple entry visa?,"Usually yes for student visas Sources: https://international.uni.wroc.pl/en/admission-full-degree-studies/useful-information-full-degree-students",Visa & Immigration,https://international.uni.wroc.pl/en/admission-full-degree-studies/useful-information-full-degree-students
382,Visa rejection reasons?,"Incomplete documents, insufficient funds, unclear purpose Sources: https://admission.sum.edu.pl/immigration-rules/",Visa & Immigration,https://admission.sum.edu.pl/immigration-rules/
383,Appeal visa rejection?,"Limited appeal options, check consulate Sources: https://welcome.uw.edu.pl/how-to-get-student-mobility-instruction/",Visa & Immigration,https://welcome.uw.edu.pl/how-to-get-student-mobility-instruction/
384,Insurance for visa?,"Mandatory, NFZ or private Sources: https://sspw.pl/wp-content/uploads/2024/10/Arrival_info_Pack_2024_WUT.pdf",Visa & Immigration,https://sspw.pl/wp-content/uploads/2024/10/Arrival_info_Pack_2024_WUT.pdf
385,Minimum funds for residence permit?,"PLN 776/month per person Sources: https://cudzoziemiec.bydgoszcz.pl/en/stay-in-poland/temporary-stay/student/",Visa & Immigration,https://cudzoziemiec.bydgoszcz.pl/en/stay-in-poland/temporary-stay/student/
386,Bank statement requirements?,"Recent statements showing sufficient funds Sources: https://cudzoziemiec.bydgoszcz.pl/en/stay-in-poland/temporary-stay/student/",Visa & Immigration,https://cudzoziemiec.bydgoszcz.pl/en/stay-in-poland/temporary-stay/student/
387,Scholarship as financial proof?,"Yes, scholarship letter acceptable Sources: https://cudzoziemiec.bydgoszcz.pl/en/stay-in-poland/temporary-stay/student/",Visa & Immigration,https://cudzoziemiec.bydgoszcz.pl/en/stay-in-poland/temporary-stay/student/
388,Health certificate for permit?,"May be required, check requirements Sources: https://cudzoziemiec.bydgoszcz.pl/en/stay-in-poland/temporary-stay/student/",Visa & Immigration,https://cudzoziemiec.bydgoszcz.pl/en/stay-in-poland/temporary-stay/student/
389,Criminal record check?,"May be required for residence permit Sources: https://cudzoziemiec.bydgoszcz.pl/en/stay-in-poland/temporary-stay/student/",Visa & Immigration,https://cudzoziemiec.bydgoszcz.pl/en/stay-in-poland/temporary-stay/student/
390,Biometric data for permit?,"Fingerprints required when submitting application Sources: https://cudzoziemiec.bydgoszcz.pl/en/stay-in-poland/temporary-stay/student/",Visa & Immigration,https://cudzoziemiec.bydgoszcz.pl/en/stay-in-poland/temporary-stay/student/
391,Permit application fee payment?,"At Voivodeship Office or bank Sources: https://cudzoziemiec.bydgoszcz.pl/en/stay-in-poland/temporary-stay/student/",Visa & Immigration,https://cudzoziemiec.bydgoszcz.pl/en/stay-in-poland/temporary-stay/student/
392,Temporary stay confirmation?,"Certificate of residence application receipt Sources: https://cudzoziemiec.bydgoszcz.pl/en/stay-in-poland/temporary-stay/student/",Visa & Immigration,https://cudzoziemiec.bydgoszcz.pl/en/stay-in-poland/temporary-stay/student/
393,Stay legal after visa expiry?,"Yes, if residence permit application submitted on time Sources: https://international.uni.wroc.pl/en/admission-full-degree-studies/useful-information-full-degree-students",Visa & Immigration,https://international.uni.wroc.pl/en/admission-full-degree-studies/useful-information-full-degree-students
394,Student permit for family?,"Separate applications, family reunification rules Sources: https://bpm.uw.edu.pl/en/health-insurance/",Visa & Immigration,https://bpm.uw.edu.pl/en/health-insurance/
395,Change from tourist to student visa?,"Generally not possible, return home to apply Sources: https://welcome.uw.edu.pl/how-to-get-student-mobility-instruction/",Visa & Immigration,https://welcome.uw.edu.pl/how-to-get-student-mobility-instruction/
396,Where register upon arrival?,"International Students Office, room 233, Main Building Sources: https://sspw.pl/wp-content/uploads/2024/10/Arrival_info_Pack_2024_WUT.pdf",Registration & Enrollment,https://sspw.pl/wp-content/uploads/2024/10/Arrival_info_Pack_2024_WUT.pdf
397,When register for courses?,"Shortly before semester starts Sources: https://bwz.uw.edu.pl/en/frequently-asked-questions/",Registration & Enrollment,https://bwz.uw.edu.pl/en/frequently-asked-questions/
398,Learning Agreement enough?,"No, must register in USOSweb system Sources: https://bwz.uw.edu.pl/en/frequently-asked-questions/",Registration & Enrollment,https://bwz.uw.edu.pl/en/frequently-asked-questions/
399,Register courses from other faculties?,"Yes, choose most from receiving unit + 2 others Sources: https://bwz.uw.edu.pl/en/frequently-asked-questions/",Registration & Enrollment,https://bwz.uw.edu.pl/en/frequently-asked-questions/
400,Add/drop period?,"One week after classes begin Sources: https://bwz.uw.edu.pl/en/frequently-asked-questions/",Registration & Enrollment,https://bwz.uw.edu.pl/en/frequently-asked-questions/
401,PE registration?,"Via USOS, check SWFIS website Sources: https://sspw.pl/wp-content/uploads/2024/10/Arrival_info_Pack_2024_WUT.pdf",Registration & Enrollment,https://sspw.pl/wp-content/uploads/2024/10/Arrival_info_Pack_2024_WUT.pdf
402,Token registration?,"Virtual currency for optional courses Sources: https://welcome.uw.edu.pl/during-your-stay/course-registration/",Registration & Enrollment,https://welcome.uw.edu.pl/during-your-stay/course-registration/
403,Automatic course registration?,"Some faculties auto-register first-years Sources: https://welcome.uw.edu.pl/during-your-stay/course-registration/",Registration & Enrollment,https://welcome.uw.edu.pl/during-your-stay/course-registration/
404,Change registration after deadline?,"Usually not possible after add/drop Sources: https://bwz.uw.edu.pl/en/frequently-asked-questions/",Registration & Enrollment,https://bwz.uw.edu.pl/en/frequently-asked-questions/
405,Conditional registration next semester?,"Pending specific requirements completion Sources: https://sspw.pl/wp-content/uploads/2024/10/Arrival_info_Pack_2024_WUT.pdf",Registration & Enrollment,https://sspw.pl/wp-content/uploads/2024/10/Arrival_info_Pack_2024_WUT.pdf
406,Registration for exams?,"Via USOS during registration periods Sources: https://sspw.pl/wp-content/uploads/2024/10/Arrival_info_Pack_2024_WUT.pdf",Registration & Enrollment,https://sspw.pl/wp-content/uploads/2024/10/Arrival_info_Pack_2024_WUT.pdf
407,Late registration possible?,"Contact Dean's Office, usually not allowed Sources: https://bwz.uw.edu.pl/en/frequently-asked-questions/",Registration & Enrollment,https://bwz.uw.edu.pl/en/frequently-asked-questions/
408,Registration priority?,"First-come first-served Sources: https://bwz.uw.edu.pl/en/frequently-asked-questions/",Registration & Enrollment,https://bwz.uw.edu.pl/en/frequently-asked-questions/
409,Full courses alternatives?,"Try equivalent course or different group Sources: https://bwz.uw.edu.pl/en/frequently-asked-questions/",Registration & Enrollment,https://bwz.uw.edu.pl/en/frequently-asked-questions/
410,Verify registration status?,"Check in USOS student section Sources: https://sspw.pl/wp-content/uploads/2024/10/Arrival_info_Pack_2024_WUT.pdf",Registration & Enrollment,https://sspw.pl/wp-content/uploads/2024/10/Arrival_info_Pack_2024_WUT.pdf
411,Unregister from course?,"During add/drop period only Sources: https://bwz.uw.edu.pl/en/frequently-asked-questions/",Registration & Enrollment,https://bwz.uw.edu.pl/en/frequently-asked-questions/
412,Registration technical issues?,"Contact Dean's Office or IT support Sources: https://welcome.uw.edu.pl/during-your-stay/course-registration/",Registration & Enrollment,https://welcome.uw.edu.pl/during-your-stay/course-registration/
413,Token allocation?,"Distributed before registration period Sources: https://welcome.uw.edu.pl/during-your-stay/course-registration/",Registration & Enrollment,https://welcome.uw.edu.pl/during-your-stay/course-registration/
414,Use tokens?,"Select courses, add to cart with green arrow Sources: https://welcome.uw.edu.pl/during-your-stay/course-registration/",Registration & Enrollment,https://welcome.uw.edu.pl/during-your-stay/course-registration/
415,Registration rounds?,"One or more rounds per registration Sources: https://welcome.uw.edu.pl/during-your-stay/course-registration/",Registration & Enrollment,https://welcome.uw.edu.pl/during-your-stay/course-registration/
416,Register for whole year?,"Winter registration includes whole-year courses Sources: https://bwz.uw.edu.pl/en/frequently-asked-questions/",Registration & Enrollment,https://bwz.uw.edu.pl/en/frequently-asked-questions/
417,Summer semester registration?,"Separate, typically in February Sources: https://bwz.uw.edu.pl/en/frequently-asked-questions/",Registration & Enrollment,https://bwz.uw.edu.pl/en/frequently-asked-questions/
418,Register for multiple sections?,"No, register for one section per course Sources: https://welcome.uw.edu.pl/during-your-stay/course-registration/",Registration & Enrollment,https://welcome.uw.edu.pl/during-your-stay/course-registration/
419,Prerequisite checking?,"System may check, follow curriculum order Sources: https://www.is.pw.edu.pl/images/regulaminy/Academic_Regulations_at_the_Warsaw_University_of_Technology.pdf",Registration & Enrollment,https://www.is.pw.edu.pl/images/regulaminy/Academic_Regulations_at_the_Warsaw_University_of_Technology.pdf
420,Registration confirmation?,"Visible in USOS after successful registration Sources: https://welcome.uw.edu.pl/during-your-stay/course-registration/",Registration & Enrollment,https://welcome.uw.edu.pl/during-your-stay/course-registration/
421,Change study mode?,"HTU determines curriculum differences Sources: https://bok.uw.edu.pl/the-rules-and-regulations-of-study-faq/",Registration & Enrollment,https://bok.uw.edu.pl/the-rules-and-regulations-of-study-faq/
422,Registration deadlines published?,"On faculty websites and USOS Sources: https://welcome.uw.edu.pl/during-your-stay/course-registration/",Registration & Enrollment,https://welcome.uw.edu.pl/during-your-stay/course-registration/
423,Special registration for disabled?,"Contact Dean's Office for arrangements Sources: https://sspw.pl/wp-content/uploads/2024/10/Arrival_info_Pack_2024_WUT.pdf",Registration & Enrollment,https://sspw.pl/wp-content/uploads/2024/10/Arrival_info_Pack_2024_WUT.pdf
