ID,Question,Answer,Category,Source_URLs
106,Social scholarship available?,"Yes, check Student Welfare Office Sources: https://sspw.pl/wp-content/uploads/2024/10/Arrival_info_Pack_2024_WUT.pdf",Tuition & Financial,https://sspw.pl/wp-content/uploads/2024/10/Arrival_info_Pack_2024_WUT.pdf
107,Part-time tuition?,"Fees apply for all part-time students Sources: https://eng.pw.edu.pl/content/download/4522/37011/file/2022%2004%2028%20Projekt%20dec%20oplaty%20cudzoziemcy_ENG.pdf",Tuition & Financial,https://eng.pw.edu.pl/content/download/4522/37011/file/2022%2004%2028%20Projekt%20dec%20oplaty%20cudzoziemcy_ENG.pdf
108,Family discounts?,"No general family discounts Sources: https://eng.pw.edu.pl/content/download/4522/37011/file/2022%2004%2028%20Projekt%20dec%20oplaty%20cudzoziemcy_ENG.pdf",Tuition & Financial,https://eng.pw.edu.pl/content/download/4522/37011/file/2022%2004%2028%20Projekt%20dec%20oplaty%20cudzoziemcy_ENG.pdf
109,Bank account needed?,"Yes, for receiving scholarships and payments Sources: https://welcome.uw.edu.pl/how-to-get-student-mobility-instruction/",Tuition & Financial,https://welcome.uw.edu.pl/how-to-get-student-mobility-instruction/
110,Currency for payment?,"PLN for EU, EUR for non-EU Sources: https://eng.pw.edu.pl/content/download/4522/37011/file/2022%2004%2028%20Projekt%20dec%20oplaty%20cudzoziemcy_ENG.pdf",Tuition & Financial,https://eng.pw.edu.pl/content/download/4522/37011/file/2022%2004%2028%20Projekt%20dec%20oplaty%20cudzoziemcy_ENG.pdf
111,Refund timing?,"Depends on circumstances, check policy Sources: https://www.students.pw.edu.pl/Studies-Offer/M.Sc.-offer",Tuition & Financial,https://www.students.pw.edu.pl/Studies-Offer/M.Sc.-offer
112,Installment payments?,"Discuss with Accountancy Office Sources: https://uczelnia.akademiata.pl/en/recruitment-process-for-wseiz/recruitment-for-international-students/",Tuition & Financial,https://uczelnia.akademiata.pl/en/recruitment-process-for-wseiz/recruitment-for-international-students/
113,Financial documents required?,"For visa: bank statement, scholarship proof Sources: https://cudzoziemiec.bydgoszcz.pl/en/stay-in-poland/temporary-stay/student/",Tuition & Financial,https://cudzoziemiec.bydgoszcz.pl/en/stay-in-poland/temporary-stay/student/
114,Minimum funds for visa?,"PLN 776/month living costs Sources: https://cudzoziemiec.bydgoszcz.pl/en/stay-in-poland/temporary-stay/student/",Tuition & Financial,https://cudzoziemiec.bydgoszcz.pl/en/stay-in-poland/temporary-stay/student/
115,Scholarship covers accommodation?,"Check specific scholarship terms Sources: https://www.students.pw.edu.pl/Resources/Students-Life/Scholarships",Tuition & Financial,https://www.students.pw.edu.pl/Resources/Students-Life/Scholarships
116,Tax on scholarships?,"Contact university finance office Sources: https://sspw.pl/wp-content/uploads/2024/10/Arrival_info_Pack_2024_WUT.pdf",Tuition & Financial,https://sspw.pl/wp-content/uploads/2024/10/Arrival_info_Pack_2024_WUT.pdf
117,Tuition for Polish programs?,"Lower for EU, varies by program Sources: https://eng.pw.edu.pl/content/download/4522/37011/file/2022%2004%2028%20Projekt%20dec%20oplaty%20cudzoziemcy_ENG.pdf",Tuition & Financial,https://eng.pw.edu.pl/content/download/4522/37011/file/2022%2004%2028%20Projekt%20dec%20oplaty%20cudzoziemcy_ENG.pdf
118,Exchange program costs?,"Often tuition-free, pay living expenses Sources: https://erasmus-plus.ec.europa.eu/opportunities/opportunities-for-individuals/students/studying-abroad",Tuition & Financial,https://erasmus-plus.ec.europa.eu/opportunities/opportunities-for-individuals/students/studying-abroad
119,Lab fees separate?,"Included in tuition typically Sources: https://eng.pw.edu.pl/content/download/4522/37011/file/2022%2004%2028%20Projekt%20dec%20oplaty%20cudzoziemcy_ENG.pdf",Tuition & Financial,https://eng.pw.edu.pl/content/download/4522/37011/file/2022%2004%2028%20Projekt%20dec%20oplaty%20cudzoziemcy_ENG.pdf
120,Exam retake fees?,"Included, but excessive retakes may incur fees Sources: https://eng.pw.edu.pl/content/download/4522/37011/file/2022%2004%2028%20Projekt%20dec%20oplaty%20cudzoziemcy_ENG.pdf",Tuition & Financial,https://eng.pw.edu.pl/content/download/4522/37011/file/2022%2004%2028%20Projekt%20dec%20oplaty%20cudzoziemcy_ENG.pdf
121,Graduation ceremony costs?,"Free, official documents included Sources: https://www.students.pw.edu.pl/Studies-Offer/M.Sc.-offer",Tuition & Financial,https://www.students.pw.edu.pl/Studies-Offer/M.Sc.-offer
122,Student discount card cost?,"Included with Student ID Sources: https://sspw.pl/wp-content/uploads/2024/10/Arrival_info_Pack_2024_WUT.pdf",Tuition & Financial,https://sspw.pl/wp-content/uploads/2024/10/Arrival_info_Pack_2024_WUT.pdf
123,Library fees?,"Free with Student ID card Sources: https://bg.pw.edu.pl/index.php/en/library-account",Tuition & Financial,https://bg.pw.edu.pl/index.php/en/library-account
124,Sports facilities cost?,"Free with valid Student ID Sources: https://sspw.pl/wp-content/uploads/2024/10/Arrival_info_Pack_2024_WUT.pdf",Tuition & Financial,https://sspw.pl/wp-content/uploads/2024/10/Arrival_info_Pack_2024_WUT.pdf
125,Insurance required cost?,"~55 PLN/month for non-EU NFZ Sources: https://sspw.pl/wp-content/uploads/2024/10/Arrival_info_Pack_2024_WUT.pdf",Tuition & Financial,https://sspw.pl/wp-content/uploads/2024/10/Arrival_info_Pack_2024_WUT.pdf
126,Appeals for financial decisions?,"Submit to Vice-Rector for Student Affairs Sources: https://sspw.pl/wp-content/uploads/2024/10/Arrival_info_Pack_2024_WUT.pdf",Tuition & Financial,https://sspw.pl/wp-content/uploads/2024/10/Arrival_info_Pack_2024_WUT.pdf
127,Emergency financial aid?,"Contact Student Welfare Office Sources: https://sspw.pl/wp-content/uploads/2024/10/Arrival_info_Pack_2024_WUT.pdf",Tuition & Financial,https://sspw.pl/wp-content/uploads/2024/10/Arrival_info_Pack_2024_WUT.pdf
128,Lost card replacement fee?,"PLN 22 for replacement Sources: https://www.sjo.pw.edu.pl/wut/participants/faq/",Tuition & Financial,https://www.sjo.pw.edu.pl/wut/participants/faq/
129,Visa application fee?,"Polish consulate sets fees Sources: https://admission.sum.edu.pl/immigration-rules/",Tuition & Financial,https://admission.sum.edu.pl/immigration-rules/
130,PESEL number cost?,"Free when registering residence Sources: https://welcome.uw.edu.pl/during-your-stay/registration-of-address/",Tuition & Financial,https://welcome.uw.edu.pl/during-your-stay/registration-of-address/
131,Meldunek registration cost?,"Free of charge Sources: https://loginlublin.pl/en/registration-of-a-foreigner-meldunek/",Tuition & Financial,https://loginlublin.pl/en/registration-of-a-foreigner-meldunek/
132,Residence permit application fee?,"Check Voivodeship Office Sources: https://cudzoziemiec.bydgoszcz.pl/en/stay-in-poland/temporary-stay/student/",Tuition & Financial,https://cudzoziemiec.bydgoszcz.pl/en/stay-in-poland/temporary-stay/student/
133,Official translation costs?,"Varies by sworn translator Sources: https://uczelnia.akademiata.pl/en/recruitment-process-for-wseiz/recruitment-for-international-students/",Tuition & Financial,https://uczelnia.akademiata.pl/en/recruitment-process-for-wseiz/recruitment-for-international-students/
134,Notarization costs in Poland?,"Varies by document Sources: https://uczelnia.akademiata.pl/en/recruitment-process-for-wseiz/recruitment-for-international-students/",Tuition & Financial,https://uczelnia.akademiata.pl/en/recruitment-process-for-wseiz/recruitment-for-international-students/
135,Student travel passes?,"50% discount with Student ID Sources: https://sspw.pl/wp-content/uploads/2024/10/Arrival_info_Pack_2024_WUT.pdf",Tuition & Financial,https://sspw.pl/wp-content/uploads/2024/10/Arrival_info_Pack_2024_WUT.pdf
136,When does academic year start?,"October, with winter and summer semesters Sources: https://sspw.pl/wp-content/uploads/2024/10/Arrival_info_Pack_2024_WUT.pdf",Academic Life & Studies,https://sspw.pl/wp-content/uploads/2024/10/Arrival_info_Pack_2024_WUT.pdf
137,What is USOS?,"IT system for registration, marks, timetables, applications Sources: https://sspw.pl/wp-content/uploads/2024/10/Arrival_info_Pack_2024_WUT.pdf",Academic Life & Studies,https://sspw.pl/wp-content/uploads/2024/10/Arrival_info_Pack_2024_WUT.pdf
138,Access USOS?,"usosweb.usos.pw.edu.pl with Dean's Office credentials Sources: https://sspw.pl/wp-content/uploads/2024/10/Arrival_info_Pack_2024_WUT.pdf",Academic Life & Studies,https://sspw.pl/wp-content/uploads/2024/10/Arrival_info_Pack_2024_WUT.pdf
139,What is LeOn?,"Remote learning platform, login via USOS Sources: https://sspw.pl/wp-content/uploads/2024/10/Arrival_info_Pack_2024_WUT.pdf",Academic Life & Studies,https://sspw.pl/wp-content/uploads/2024/10/Arrival_info_Pack_2024_WUT.pdf
140,Types of classes?,"Lectures, Practicals (PTC), Tutorials, Seminars Sources: https://sspw.pl/wp-content/uploads/2024/10/Arrival_info_Pack_2024_WUT.pdf",Academic Life & Studies,https://sspw.pl/wp-content/uploads/2024/10/Arrival_info_Pack_2024_WUT.pdf
141,Class duration?,"60 or 90 minutes, sometimes 2×45min blocks Sources: https://sspw.pl/wp-content/uploads/2024/10/Arrival_info_Pack_2024_WUT.pdf",Academic Life & Studies,https://sspw.pl/wp-content/uploads/2024/10/Arrival_info_Pack_2024_WUT.pdf
142,Examination period?,"2-3 weeks after each semester, no regular classes Sources: https://sspw.pl/wp-content/uploads/2024/10/Arrival_info_Pack_2024_WUT.pdf",Academic Life & Studies,https://sspw.pl/wp-content/uploads/2024/10/Arrival_info_Pack_2024_WUT.pdf
143,Autumn examination?,"October retakes only, for failed exams Sources: https://sspw.pl/wp-content/uploads/2024/10/Arrival_info_Pack_2024_WUT.pdf",Academic Life & Studies,https://sspw.pl/wp-content/uploads/2024/10/Arrival_info_Pack_2024_WUT.pdf
144,Lectures mandatory?,"Many optional, but tutorials/practicals usually obligatory Sources: https://sspw.pl/wp-content/uploads/2024/10/Arrival_info_Pack_2024_WUT.pdf",Academic Life & Studies,https://sspw.pl/wp-content/uploads/2024/10/Arrival_info_Pack_2024_WUT.pdf
145,Grading scale?,"2.0 (fail) to 5.0 (excellent) with ECTS credits Sources: https://www.is.pw.edu.pl/images/regulaminy/Academic_Regulations_at_the_Warsaw_University_of_Technology.pdf",Academic Life & Studies,https://www.is.pw.edu.pl/images/regulaminy/Academic_Regulations_at_the_Warsaw_University_of_Technology.pdf
146,What is diploma thesis?,"Final dissertation for degree, discussed in seminars Sources: https://sspw.pl/wp-content/uploads/2024/10/Arrival_info_Pack_2024_WUT.pdf",Academic Life & Studies,https://sspw.pl/wp-content/uploads/2024/10/Arrival_info_Pack_2024_WUT.pdf
147,ECTS credit hours?,"25-30 hours work per credit point Sources: https://www.reddit.com/r/AskEurope/comments/d7qcrf/ects_european_credit_transfer_and_accumulation/",Academic Life & Studies,https://www.reddit.com/r/AskEurope/comments/d7qcrf/ects_european_credit_transfer_and_accumulation/
148,Change field of study?,"Possible, HTU determines curriculum differences Sources: https://bok.uw.edu.pl/the-rules-and-regulations-of-study-faq/",Academic Life & Studies,https://bok.uw.edu.pl/the-rules-and-regulations-of-study-faq/
149,Minimum course load?,"At least 1 course, max 30 ECTS/semester Sources: https://bwz.uw.edu.pl/en/frequently-asked-questions/",Academic Life & Studies,https://bwz.uw.edu.pl/en/frequently-asked-questions/
150,Write thesis during exchange?,"No ECTS for thesis, must take courses Sources: https://bwz.uw.edu.pl/en/frequently-asked-questions/",Academic Life & Studies,https://bwz.uw.edu.pl/en/frequently-asked-questions/
151,Find class schedule?,"USOS system, also faculty websites Sources: https://sspw.pl/wp-content/uploads/2024/10/Arrival_info_Pack_2024_WUT.pdf",Academic Life & Studies,https://sspw.pl/wp-content/uploads/2024/10/Arrival_info_Pack_2024_WUT.pdf
152,2025/2026 academic calendar?,"Oct 1, 2025-Feb 15, 2026 (winter); Feb 16-Sep 30, 2026 (summer) Sources: https://welcome.uw.edu.pl/before-you-arrive/academic-calendar/",Academic Life & Studies,https://welcome.uw.edu.pl/before-you-arrive/academic-calendar/
153,Winter exam sessions?,"Early to mid-February Sources: https://welcome.uw.edu.pl/before-you-arrive/academic-calendar/",Academic Life & Studies,https://welcome.uw.edu.pl/before-you-arrive/academic-calendar/
154,Failed exam?,"Retake during designated retake periods Sources: https://sspw.pl/wp-content/uploads/2024/10/Arrival_info_Pack_2024_WUT.pdf",Academic Life & Studies,https://sspw.pl/wp-content/uploads/2024/10/Arrival_info_Pack_2024_WUT.pdf
155,Improve passed grade?,"Depends on course regulations Sources: https://www.is.pw.edu.pl/images/regulaminy/Academic_Regulations_at_the_Warsaw_University_of_Technology.pdf",Academic Life & Studies,https://www.is.pw.edu.pl/images/regulaminy/Academic_Regulations_at_the_Warsaw_University_of_Technology.pdf
156,Attendance requirements?,"Typically 2 absences allowed per semester Sources: https://bwz.uw.edu.pl/en/frequently-asked-questions/",Academic Life & Studies,https://bwz.uw.edu.pl/en/frequently-asked-questions/
157,Late assignment penalties?,"Set by course tutor in course regulations Sources: https://www.is.pw.edu.pl/images/regulaminy/Academic_Regulations_at_the_Warsaw_University_of_Technology.pdf",Academic Life & Studies,https://www.is.pw.edu.pl/images/regulaminy/Academic_Regulations_at_the_Warsaw_University_of_Technology.pdf
158,Course registration timing?,"Shortly before semester starts Sources: https://bwz.uw.edu.pl/en/frequently-asked-questions/",Academic Life & Studies,https://bwz.uw.edu.pl/en/frequently-asked-questions/
159,Add/drop period?,"One week after classes begin Sources: https://bwz.uw.edu.pl/en/frequently-asked-questions/",Academic Life & Studies,https://bwz.uw.edu.pl/en/frequently-asked-questions/
160,Change course group?,"Usually not allowed after registration Sources: https://www.sjo.pw.edu.pl/wut/participants/faq/",Academic Life & Studies,https://www.sjo.pw.edu.pl/wut/participants/faq/
161,Lab reports required?,"Yes for PTC classes, submitted next class Sources: https://sspw.pl/wp-content/uploads/2024/10/Arrival_info_Pack_2024_WUT.pdf",Academic Life & Studies,https://sspw.pl/wp-content/uploads/2024/10/Arrival_info_Pack_2024_WUT.pdf
162,Lecture notes provided?,"Varies by lecturer, take your own notes Sources: https://sspw.pl/wp-content/uploads/2024/10/Arrival_info_Pack_2024_WUT.pdf",Academic Life & Studies,https://sspw.pl/wp-content/uploads/2024/10/Arrival_info_Pack_2024_WUT.pdf
163,Office hours with professors?,"Check individual professor schedules in USOS Sources: https://sspw.pl/wp-content/uploads/2024/10/Arrival_info_Pack_2024_WUT.pdf",Academic Life & Studies,https://sspw.pl/wp-content/uploads/2024/10/Arrival_info_Pack_2024_WUT.pdf
164,Group projects?,"Common in tutorials and practicals Sources: https://sspw.pl/wp-content/uploads/2024/10/Arrival_info_Pack_2024_WUT.pdf",Academic Life & Studies,https://sspw.pl/wp-content/uploads/2024/10/Arrival_info_Pack_2024_WUT.pdf
165,Presentations required?,"Depends on course, stated in syllabus Sources: https://www.is.pw.edu.pl/images/regulaminy/Academic_Regulations_at_the_Warsaw_University_of_Technology.pdf",Academic Life & Studies,https://www.is.pw.edu.pl/images/regulaminy/Academic_Regulations_at_the_Warsaw_University_of_Technology.pdf
166,Online classes available?,"Some courses, especially via LeOn platform Sources: https://sspw.pl/wp-content/uploads/2024/10/Arrival_info_Pack_2024_WUT.pdf",Academic Life & Studies,https://sspw.pl/wp-content/uploads/2024/10/Arrival_info_Pack_2024_WUT.pdf
167,Exam format?,"Written, oral, or mixed depending on course Sources: https://www.is.pw.edu.pl/images/regulaminy/Academic_Regulations_at_the_Warsaw_University_of_Technology.pdf",Academic Life & Studies,https://www.is.pw.edu.pl/images/regulaminy/Academic_Regulations_at_the_Warsaw_University_of_Technology.pdf
168,Exam duration?,"Varies, typically 90-120 minutes written Sources: https://www.is.pw.edu.pl/images/regulaminy/Academic_Regulations_at_the_Warsaw_University_of_Technology.pdf",Academic Life & Studies,https://www.is.pw.edu.pl/images/regulaminy/Academic_Regulations_at_the_Warsaw_University_of_Technology.pdf
169,Materials allowed in exam?,"Specified by course regulations Sources: https://www.is.pw.edu.pl/images/regulaminy/Academic_Regulations_at_the_Warsaw_University_of_Technology.pdf",Academic Life & Studies,https://www.is.pw.edu.pl/images/regulaminy/Academic_Regulations_at_the_Warsaw_University_of_Technology.pdf
170,Plagiarism consequences?,"Serious academic offense, possible expulsion Sources: https://www.is.pw.edu.pl/images/regulaminy/Academic_Regulations_at_the_Warsaw_University_of_Technology.pdf",Academic Life & Studies,https://www.is.pw.edu.pl/images/regulaminy/Academic_Regulations_at_the_Warsaw_University_of_Technology.pdf
171,Academic integrity policy?,"Defined in Academic Regulations Sources: https://sspw.pl/wp-content/uploads/2024/10/Arrival_info_Pack_2024_WUT.pdf",Academic Life & Studies,https://sspw.pl/wp-content/uploads/2024/10/Arrival_info_Pack_2024_WUT.pdf
172,Course withdrawal deadline?,"Check academic calendar, typically mid-semester Sources: https://welcome.uw.edu.pl/before-you-arrive/academic-calendar/",Academic Life & Studies,https://welcome.uw.edu.pl/before-you-arrive/academic-calendar/
173,Incomplete grades?,"Must complete requirements within timeframe Sources: https://www.is.pw.edu.pl/images/regulaminy/Academic_Regulations_at_the_Warsaw_University_of_Technology.pdf",Academic Life & Studies,https://www.is.pw.edu.pl/images/regulaminy/Academic_Regulations_at_the_Warsaw_University_of_Technology.pdf
174,Summer classes offered?,"Limited, mainly examination periods Sources: https://sspw.pl/wp-content/uploads/2024/10/Arrival_info_Pack_2024_WUT.pdf",Academic Life & Studies,https://sspw.pl/wp-content/uploads/2024/10/Arrival_info_Pack_2024_WUT.pdf
175,Study abroad during degree?,"Yes, via Erasmus+ or bilateral programsSources: https://www.cwm.pw.edu.pl/en/Education-programmes/Bilateral-exchange/Outgoing-students",Academic Life & Studies,https://www.cwm.pw.edu.pl/en/Education-programmes/Bilateral-exchange/Outgoing-students
176,Credit transfer?,"Via ECTS system for recognized courses Sources: https://www.is.pw.edu.pl/images/regulaminy/Academic_Regulations_at_the_Warsaw_University_of_Technology.pdf",Academic Life & Studies,https://www.is.pw.edu.pl/images/regulaminy/Academic_Regulations_at_the_Warsaw_University_of_Technology.pdf
177,Thesis supervisor selection?,"Discuss with Faculty coordinator Sources: https://sspw.pl/wp-content/uploads/2024/10/Arrival_info_Pack_2024_WUT.pdf",Academic Life & Studies,https://sspw.pl/wp-content/uploads/2024/10/Arrival_info_Pack_2024_WUT.pdf
178,Thesis defense?,"Oral presentation and Q&A with committee Sources: https://www.is.pw.edu.pl/images/regulaminy/Academic_Regulations_at_the_Warsaw_University_of_Technology.pdf",Academic Life & Studies,https://www.is.pw.edu.pl/images/regulaminy/Academic_Regulations_at_the_Warsaw_University_of_Technology.pdf
179,Thesis submission deadline?,"Set by Faculty, before defense Sources: https://www.is.pw.edu.pl/images/regulaminy/Academic_Regulations_at_the_Warsaw_University_of_Technology.pdf",Academic Life & Studies,https://www.is.pw.edu.pl/images/regulaminy/Academic_Regulations_at_the_Warsaw_University_of_Technology.pdf
180,Thesis format requirements?,"Faculty-specific, check with coordinator Sources: https://www.is.pw.edu.pl/images/regulaminy/Academic_Regulations_at_the_Warsaw_University_of_Technology.pdf",Academic Life & Studies,https://www.is.pw.edu.pl/images/regulaminy/Academic_Regulations_at_the_Warsaw_University_of_Technology.pdf
181,Research opportunities?,"Student science groups and Faculty projects Sources: https://sspw.pl/wp-content/uploads/2024/10/Arrival_info_Pack_2024_WUT.pdf",Academic Life & Studies,https://sspw.pl/wp-content/uploads/2024/10/Arrival_info_Pack_2024_WUT.pdf
182,Laboratory safety training?,"Required for lab courses Sources: https://sspw.pl/wp-content/uploads/2024/10/Arrival_info_Pack_2024_WUT.pdf",Academic Life & Studies,https://sspw.pl/wp-content/uploads/2024/10/Arrival_info_Pack_2024_WUT.pdf
183,Equipment access?,"During scheduled lab hours Sources: https://sspw.pl/wp-content/uploads/2024/10/Arrival_info_Pack_2024_WUT.pdf",Academic Life & Studies,https://sspw.pl/wp-content/uploads/2024/10/Arrival_info_Pack_2024_WUT.pdf
184,Library resources?,"Physical and online, accessed with Student ID Sources: https://bg.pw.edu.pl/index.php/en/library-account",Academic Life & Studies,https://bg.pw.edu.pl/index.php/en/library-account
185,Borrowing limits?,"Set by Main Library, check library account Sources: https://bg.pw.edu.pl/index.php/en/library-account",Academic Life & Studies,https://bg.pw.edu.pl/index.php/en/library-account
186,Study spaces available?,"Main Library and faculty buildings Sources: https://bg.pw.edu.pl/index.php/en/library-account",Academic Life & Studies,https://bg.pw.edu.pl/index.php/en/library-account
187,Computer labs access?,"Available, schedule varies by faculty Sources: https://sspw.pl/wp-content/uploads/2024/10/Arrival_info_Pack_2024_WUT.pdf",Academic Life & Studies,https://sspw.pl/wp-content/uploads/2024/10/Arrival_info_Pack_2024_WUT.pdf
188,Printing services?,"Available on campus, pay per page Sources: https://sspw.pl/wp-content/uploads/2024/10/Arrival_info_Pack_2024_WUT.pdf",Academic Life & Studies,https://sspw.pl/wp-content/uploads/2024/10/Arrival_info_Pack_2024_WUT.pdf
189,Academic advising?,"Through Faculty coordinator or Dean's Office Sources: https://sspw.pl/wp-content/uploads/2024/10/Arrival_info_Pack_2024_WUT.pdf",Academic Life & Studies,https://sspw.pl/wp-content/uploads/2024/10/Arrival_info_Pack_2024_WUT.pdf
190,Course conflicts?,"Report to Dean's Office for resolution Sources: https://bwz.uw.edu.pl/en/frequently-asked-questions/",Academic Life & Studies,https://bwz.uw.edu.pl/en/frequently-asked-questions/
191,Overload approval?,"Request through Dean's Office if exceeding 30 ECTS Sources: https://bwz.uw.edu.pl/en/frequently-asked-questions/",Academic Life & Studies,https://bwz.uw.edu.pl/en/frequently-asked-questions/
192,Independent study?,"Possible with professor approval Sources: https://www.is.pw.edu.pl/images/regulaminy/Academic_Regulations_at_the_Warsaw_University_of_Technology.pdf",Academic Life & Studies,https://www.is.pw.edu.pl/images/regulaminy/Academic_Regulations_at_the_Warsaw_University_of_Technology.pdf
193,Internship requirements?,"Varies by program, check curriculum Sources: https://www.is.pw.edu.pl/images/regulaminy/Academic_Regulations_at_the_Warsaw_University_of_Technology.pdf",Academic Life & Studies,https://www.is.pw.edu.pl/images/regulaminy/Academic_Regulations_at_the_Warsaw_University_of_Technology.pdf
194,Internship credits?,"If part of curriculum, yes Sources: https://www.is.pw.edu.pl/images/regulaminy/Academic_Regulations_at_the_Warsaw_University_of_Technology.pdf",Academic Life & Studies,https://www.is.pw.edu.pl/images/regulaminy/Academic_Regulations_at_the_Warsaw_University_of_Technology.pdf
195,Career services?,"Located at Polna 50, biurokarier@pw.edu.pl Sources: https://sspw.pl/wp-content/uploads/2024/10/Arrival_info_Pack_2024_WUT.pdf",Academic Life & Studies,https://sspw.pl/wp-content/uploads/2024/10/Arrival_info_Pack_2024_WUT.pdf
196,Job fairs?,"Organized by Career Service annually Sources: https://sspw.pl/wp-content/uploads/2024/10/Arrival_info_Pack_2024_WUT.pdf",Academic Life & Studies,https://sspw.pl/wp-content/uploads/2024/10/Arrival_info_Pack_2024_WUT.pdf
197,Alumni network?,"Active, through Student Organizations Sources: https://sspw.pl/wp-content/uploads/2024/10/Arrival_info_Pack_2024_WUT.pdf",Academic Life & Studies,https://sspw.pl/wp-content/uploads/2024/10/Arrival_info_Pack_2024_WUT.pdf
198,Graduation requirements?,"Complete all curriculum courses, thesis, exams Sources: https://www.is.pw.edu.pl/images/regulaminy/Academic_Regulations_at_the_Warsaw_University_of_Technology.pdf",Academic Life & Studies,https://www.is.pw.edu.pl/images/regulaminy/Academic_Regulations_at_the_Warsaw_University_of_Technology.pdf
199,Graduation ceremony?,"Held several times per year Sources: https://sspw.pl/wp-content/uploads/2024/10/Arrival_info_Pack_2024_WUT.pdf",Academic Life & Studies,https://sspw.pl/wp-content/uploads/2024/10/Arrival_info_Pack_2024_WUT.pdf
200,Diploma collection?,"From Dean's Office after graduation Sources: https://sspw.pl/wp-content/uploads/2024/10/Arrival_info_Pack_2024_WUT.pdf",Academic Life & Studies,https://sspw.pl/wp-content/uploads/2024/10/Arrival_info_Pack_2024_WUT.pdf
201,Transcript requests?,"Through Dean's Office Sources: https://sspw.pl/wp-content/uploads/2024/10/Arrival_info_Pack_2024_WUT.pdf",Academic Life & Studies,https://sspw.pl/wp-content/uploads/2024/10/Arrival_info_Pack_2024_WUT.pdf
202,Grade appeals?,"Within set timeframe to course tutor first Sources: https://www.is.pw.edu.pl/images/regulaminy/Academic_Regulations_at_the_Warsaw_University_of_Technology.pdf",Academic Life & Studies,https://www.is.pw.edu.pl/images/regulaminy/Academic_Regulations_at_the_Warsaw_University_of_Technology.pdf
203,Academic probation?,"For unsatisfactory progress Sources: https://www.is.pw.edu.pl/images/regulaminy/Academic_Regulations_at_the_Warsaw_University_of_Technology.pdf",Academic Life & Studies,https://www.is.pw.edu.pl/images/regulaminy/Academic_Regulations_at_the_Warsaw_University_of_Technology.pdf
204,Resume studies after dismissal?,"Within 5 years with HTU approval Sources: https://www.is.pw.edu.pl/images/regulaminy/Academic_Regulations_at_the_Warsaw_University_of_Technology.pdf",Academic Life & Studies,https://www.is.pw.edu.pl/images/regulaminy/Academic_Regulations_at_the_Warsaw_University_of_Technology.pdf
205,Leave of absence?,"Submit application through USOS ePodania Sources: https://www.sjo.pw.edu.pl/student/na-biezaco/faq-zapisy/",Academic Life & Studies,https://www.sjo.pw.edu.pl/student/na-biezaco/faq-zapisy/
