ID,Question,Answer,Category,Source_URLs
1,What is WUT's acceptance rate?,"Approximately 71% Sources: https://www.meridean.org/poland/university/warsaw-university-of-technology",Admission & Application,https://www.meridean.org/poland/university/warsaw-university-of-technology
2,Required English level?,"Min B2: IELTS 6+, TOEFL 87+, PTE 59+Sources: https://www.meridean.org/poland/university/warsaw-university-of-technology",Admission & Application,https://www.meridean.org/poland/university/warsaw-university-of-technology
3,Application deadlines?,"May 15 (fall), Nov 15 (spring) Sources: https://bwz.uw.edu.pl/en/frequently-asked-questions/",Admission & Application,https://bwz.uw.edu.pl/en/frequently-asked-questions/
4,Required GPA?,"Min 55%, typically 70%+ with good Math/Science Sources: https://www.meridean.org/poland/university/warsaw-university-of-technology",Admission & Application,https://www.meridean.org/poland/university/warsaw-university-of-technology
5,Mail original documents?,"No, upload scans to IRK Sources: https://bwz.uw.edu.pl/en/frequently-asked-questions/",Admission & Application,https://bwz.uw.edu.pl/en/frequently-asked-questions/
6,Admission process duration?,"3-4 weeks total Sources: https://www.students.pw.edu.pl/How-to-Apply/Admission-to-M.Sc",Admission & Application,https://www.students.pw.edu.pl/How-to-Apply/Admission-to-M.Sc
7,Apply without partnership?,"Yes, as Visiting Student Sources: https://bwz.uw.edu.pl/en/frequently-asked-questions/",Admission & Application,https://bwz.uw.edu.pl/en/frequently-asked-questions/
8,What is Conditional Acceptance?,"Preliminary acceptance pending final docs Sources: https://www.students.pw.edu.pl/How-to-Apply/Admission-to-M.Sc",Admission & Application,https://www.students.pw.edu.pl/How-to-Apply/Admission-to-M.Sc
9,Submit after deadline?,"No Sources: https://bwz.uw.edu.pl/en/frequently-asked-questions/",Admission & Application,https://bwz.uw.edu.pl/en/frequently-asked-questions/
10,Entrance exams required?,"No, except Architecture/Design Sources: https://uczelnia.akademiata.pl/en/recruitment-process-for-wseiz/recruitment-for-international-students/",Admission & Application,https://uczelnia.akademiata.pl/en/recruitment-process-for-wseiz/recruitment-for-international-students/
11,International quota?,"No separate quota Sources: https://rekrutacja.uw.edu.pl/en/faq/",Admission & Application,https://rekrutacja.uw.edu.pl/en/faq/
12,Arrive late?,"Notify ISO, contact lecturers Sources: https://bwz.uw.edu.pl/en/frequently-asked-questions/",Admission & Application,https://bwz.uw.edu.pl/en/frequently-asked-questions/
13,Airport pickup?,"No, but ESN Buddy can help Sources: https://sspw.pl/wp-content/uploads/2024/10/Arrival_info_Pack_2024_WUT.pdf",Admission & Application,https://sspw.pl/wp-content/uploads/2024/10/Arrival_info_Pack_2024_WUT.pdf
14,B.Sc documents?,"Transcripts, photo, passport, English cert, form Sources: https://bwz.uw.edu.pl/en/frequently-asked-questions/",Admission & Application,https://bwz.uw.edu.pl/en/frequently-asked-questions/
15,M.Sc documents?,"Degree, transcripts, English cert, passport, form Sources: https://www.students.pw.edu.pl/How-to-Apply/Admission-to-M.Sc",Admission & Application,https://www.students.pw.edu.pl/How-to-Apply/Admission-to-M.Sc
16,Portfolio required?,"Only Architecture/Design programs Sources: https://uczelnia.akademiata.pl/en/recruitment-process-for-wseiz/recruitment-for-international-students/",Admission & Application,https://uczelnia.akademiata.pl/en/recruitment-process-for-wseiz/recruitment-for-international-students/
17,What is IRK?,"Online recruitment platform Sources: https://www.students.pw.edu.pl/How-to-Apply/Admission-to-M.Sc",Admission & Application,https://www.students.pw.edu.pl/How-to-Apply/Admission-to-M.Sc
18,Substitute required subjects?,"No substitution allowed Sources: https://rekrutacja.uw.edu.pl/en/faq/",Admission & Application,https://rekrutacja.uw.edu.pl/en/faq/
19,What is Visa Letter?,"Official document for visa application Sources: https://www.students.pw.edu.pl/How-to-Apply/Admission-to-M.Sc",Admission & Application,https://www.students.pw.edu.pl/How-to-Apply/Admission-to-M.Sc
20,Visa Letter timing?,"~1 week after document verification Sources: https://www.students.pw.edu.pl/How-to-Apply/Admission-to-M.Sc",Admission & Application,https://www.students.pw.edu.pl/How-to-Apply/Admission-to-M.Sc
21,Who processes M.Sc. applications?,"WUT International Students Office Sources: https://ww4.mini.pw.edu.pl/application-process/general-information/",Admission & Application,https://ww4.mini.pw.edu.pl/application-process/general-information/
22,M.Sc. education requirement?,"3.5+ years B.Sc. with strong technical background Sources: https://ww4.mini.pw.edu.pl/application-process/general-information/",Admission & Application,https://ww4.mini.pw.edu.pl/application-process/general-information/
23,Apply with low GPA?,"Possible but reduced chances Sources: https://www.students.pw.edu.pl/How-to-Apply/Admission-to-B.Sc",Admission & Application,https://www.students.pw.edu.pl/How-to-Apply/Admission-to-B.Sc
24,Orientation Week mandatory?,"Recommended but not mandatory Sources: https://bwz.uw.edu.pl/en/frequently-asked-questions/",Admission & Application,https://bwz.uw.edu.pl/en/frequently-asked-questions/
25,Initial verification process?,"ISO checks documents, forwards to Faculty Sources: https://www.students.pw.edu.pl/How-to-Apply/Admission-to-M.Sc",Admission & Application,https://www.students.pw.edu.pl/How-to-Apply/Admission-to-M.Sc
26,Know receiving Faculty?,"Stated in first email from ISO Sources: https://bwz.uw.edu.pl/en/frequently-asked-questions/",Admission & Application,https://bwz.uw.edu.pl/en/frequently-asked-questions/
27,Academic year structure?,"Oct-Feb (winter), Feb-June (summer) Sources: https://sspw.pl/wp-content/uploads/2024/10/Arrival_info_Pack_2024_WUT.pdf",Admission & Application,https://sspw.pl/wp-content/uploads/2024/10/Arrival_info_Pack_2024_WUT.pdf
28,Part-time studies available?,"Yes, with tuition fees Sources: https://eng.pw.edu.pl/content/download/4522/37011/file/2022%2004%2028%20Projekt%20dec%20oplaty%20cudzoziemcy_ENG.pdf",Admission & Application,https://eng.pw.edu.pl/content/download/4522/37011/file/2022%2004%2028%20Projekt%20dec%20oplaty%20cudzoziemcy_ENG.pdf
29,English-taught Faculties?,"19 Faculties offer English programs Sources: https://sspw.pl/wp-content/uploads/2024/10/Arrival_info_Pack_2024_WUT.pdf",Admission & Application,https://sspw.pl/wp-content/uploads/2024/10/Arrival_info_Pack_2024_WUT.pdf
30,Polish language required?,"No for English programs Sources: https://www.sjo.pw.edu.pl/studies-in-english/other/faq/",Admission & Application,https://www.sjo.pw.edu.pl/studies-in-english/other/faq/
31,What is Foundation Year?,"1-year prep: Polish, English, Math, Physics, IT Sources: https://www.sjo.pw.edu.pl/wut/participants/faq/",Admission & Application,https://www.sjo.pw.edu.pl/wut/participants/faq/
32,Foundation Year lead to degree?,"Yes, can continue to regular studies Sources: https://www.sjo.pw.edu.pl/wut/participants/faq/",Admission & Application,https://www.sjo.pw.edu.pl/wut/participants/faq/
33,Foreign certificate recognition?,"Depends on country, check kuratorium.waw.pl Sources: https://sspw.pl/wp-content/uploads/2024/10/Arrival_info_Pack_2024_WUT.pdf",Admission & Application,https://sspw.pl/wp-content/uploads/2024/10/Arrival_info_Pack_2024_WUT.pdf
34,When start diploma recognition?,"Immediately, takes 60+ days Sources: https://www.students.pw.edu.pl/How-to-Apply/Admission-to-M.Sc",Admission & Application,https://www.students.pw.edu.pl/How-to-Apply/Admission-to-M.Sc
35,What is NAWA recognition?,"Recognition Statement for non-EU/OECD diplomas Sources: https://apply.wseiz.pl/en_GB/contents/content/13-new-requirements",Admission & Application,https://apply.wseiz.pl/en_GB/contents/content/13-new-requirements
36,Defer admission?,"Contact ISO to discuss Sources: https://www.students.pw.edu.pl/How-to-Apply/Admission-to-M.Sc",Admission & Application,https://www.students.pw.edu.pl/How-to-Apply/Admission-to-M.Sc
37,Don't meet requirements?,"Contact ISO for options Sources: https://www.students.pw.edu.pl/How-to-Apply/Admission-to-M.Sc",Admission & Application,https://www.students.pw.edu.pl/How-to-Apply/Admission-to-M.Sc
38,Age limits?,"No age limits Sources: https://rekrutacja.uw.edu.pl/en/faq/",Admission & Application,https://rekrutacja.uw.edu.pl/en/faq/
39,Transfer from other university?,"Yes, with curriculum differences Sources: https://bok.uw.edu.pl/the-rules-and-regulations-of-study-faq/",Admission & Application,https://bok.uw.edu.pl/the-rules-and-regulations-of-study-faq/
40,Degree vs exchange students?,"Degree: full program, Exchange: 1-2 semesters Sources: https://bwz.uw.edu.pl/en/frequently-asked-questions/",Admission & Application,https://bwz.uw.edu.pl/en/frequently-asked-questions/
41,Exchange students pay tuition?,"Depends on agreement Sources: https://erasmus-plus.ec.europa.eu/opportunities/opportunities-for-individuals/students/studying-abroad",Admission & Application,https://erasmus-plus.ec.europa.eu/opportunities/opportunities-for-individuals/students/studying-abroad
42,What is Erasmus+?,"EU exchange program, 3-12 months Sources: https://erasmus-plus.ec.europa.eu/opportunities/opportunities-for-individuals/students/studying-abroad",Admission & Application,https://erasmus-plus.ec.europa.eu/opportunities/opportunities-for-individuals/students/studying-abroad
43,Become Erasmus student?,"Nominated by home university Sources: https://erasmus.pw.edu.pl/erasmusen/Incoming-Students",Admission & Application,https://erasmus.pw.edu.pl/erasmusen/Incoming-Students
44,What is bilateral exchange?,"Partnerships outside Erasmus Sources: https://www.cwm.pw.edu.pl/en/Education-programmes/Bilateral-exchange/Outgoing-students",Admission & Application,https://www.cwm.pw.edu.pl/en/Education-programmes/Bilateral-exchange/Outgoing-students
45,Study tuition-free?,"EU/EFTA citizens, Pole's Card holders Sources: https://rekrutacja.pwr.edu.pl/en/for-foreigners/fee-paying-basis-of-studies-and-scholarship-holders/admission/scholarship-progra",Admission & Application,https://rekrutacja.pwr.edu.pl/en/for-foreigners/fee-paying-basis-of-studies-and-scholarship-holders/admission/scholarship-progra
46,What is Pole's Card?,"Document certifying Polish origin with benefits Sources: https://rekrutacja.pwr.edu.pl/en/for-foreigners/fee-paying-basis-of-studies-and-scholarship-holders/admission/scholarship-progra",Admission & Application,https://rekrutacja.pwr.edu.pl/en/for-foreigners/fee-paying-basis-of-studies-and-scholarship-holders/admission/scholarship-progra
47,Visit campus before applying?,"Yes, contact ISO Sources: https://sspw.pl/wp-content/uploads/2024/10/Arrival_info_Pack_2024_WUT.pdf",Admission & Application,https://sspw.pl/wp-content/uploads/2024/10/Arrival_info_Pack_2024_WUT.pdf
48,Reference letters required?,"Varies by program Sources: https://www.students.pw.edu.pl/How-to-Apply/Admission-to-M.Sc",Admission & Application,https://www.students.pw.edu.pl/How-to-Apply/Admission-to-M.Sc
49,Documents in other languages?,"Need sworn translation Sources: https://uczelnia.akademiata.pl/en/recruitment-process-for-wseiz/recruitment-for-international-students/",Admission & Application,https://uczelnia.akademiata.pl/en/recruitment-process-for-wseiz/recruitment-for-international-students/
50,Application fee?,"Check ISO website for fees Sources: https://rekrutacja.uw.edu.pl/en/faq/",Admission & Application,https://rekrutacja.uw.edu.pl/en/faq/
51,What is Welcome Point?,"Student support office, room 233, Main Building Sources: https://sspw.pl/wp-content/uploads/2024/10/Arrival_info_Pack_2024_WUT.pdf",Admission & Application,https://sspw.pl/wp-content/uploads/2024/10/Arrival_info_Pack_2024_WUT.pdf
52,Studies in English Coordinators?,"Faculty staff for English programs Sources: https://sspw.pl/wp-content/uploads/2024/10/Arrival_info_Pack_2024_WUT.pdf",Admission & Application,https://sspw.pl/wp-content/uploads/2024/10/Arrival_info_Pack_2024_WUT.pdf
53,Contact ISO?,"Room 86, students.cwm@pw.edu.pl, +48 22 234 6150/5091 Sources: https://sspw.pl/wp-content/uploads/2024/10/Arrival_info_Pack_2024_WUT.pdf",Admission & Application,https://sspw.pl/wp-content/uploads/2024/10/Arrival_info_Pack_2024_WUT.pdf
54,Role of Dean's Office?,"Admin support: USOS, Student ID, scholarships Sources: https://sspw.pl/wp-content/uploads/2024/10/Arrival_info_Pack_2024_WUT.pdf",Admission & Application,https://sspw.pl/wp-content/uploads/2024/10/Arrival_info_Pack_2024_WUT.pdf
55,Apply to multiple programs?,"Check ISO for policies Sources: https://www.students.pw.edu.pl/How-to-Apply/Admission-to-M.Sc",Admission & Application,https://www.students.pw.edu.pl/How-to-Apply/Admission-to-M.Sc
56,After Conditional Acceptance?,"Submit Admission Documents for Visa Letter Sources: https://www.students.pw.edu.pl/How-to-Apply/Admission-to-M.Sc",Admission & Application,https://www.students.pw.edu.pl/How-to-Apply/Admission-to-M.Sc
57,Medical certificate needed?,"Some programs require health certificates Sources: https://www.is.pw.edu.pl/images/regulaminy/Academic_Regulations_at_the_Warsaw_University_of_Technology.pdf",Admission & Application,https://www.is.pw.edu.pl/images/regulaminy/Academic_Regulations_at_the_Warsaw_University_of_Technology.pdf
58,Change program after admission?,"Possible with Faculty approval Sources: https://bok.uw.edu.pl/the-rules-and-regulations-of-study-faq/",Admission & Application,https://bok.uw.edu.pl/the-rules-and-regulations-of-study-faq/
59,Vice-Dean for Student Affairs?,"Handles scholarships, dormitories, exam issues Sources: https://sspw.pl/wp-content/uploads/2024/10/Arrival_info_Pack_2024_WUT.pdf",Admission & Application,https://sspw.pl/wp-content/uploads/2024/10/Arrival_info_Pack_2024_WUT.pdf
60,Meet Dean/Vice-Dean?,"Student hours or email appointment Sources: https://sspw.pl/wp-content/uploads/2024/10/Arrival_info_Pack_2024_WUT.pdf",Admission & Application,https://sspw.pl/wp-content/uploads/2024/10/Arrival_info_Pack_2024_WUT.pdf
61,Conditional registration?,"Next semester enrollment pending requirements Sources: https://sspw.pl/wp-content/uploads/2024/10/Arrival_info_Pack_2024_WUT.pdf",Admission & Application,https://sspw.pl/wp-content/uploads/2024/10/Arrival_info_Pack_2024_WUT.pdf
62,Doctoral exchange?,"Yes, via Erasmus+ and other programs Sources: https://erasmus-plus.ec.europa.eu/opportunities/opportunities-for-individuals/students/studying-abroad",Admission & Application,https://erasmus-plus.ec.europa.eu/opportunities/opportunities-for-individuals/students/studying-abroad
63,What is ENHANCE Alliance?,"European University Alliance with WUT Sources: https://sspw.pl/wp-content/uploads/2024/10/Arrival_info_Pack_2024_WUT.pdf",Admission & Application,https://sspw.pl/wp-content/uploads/2024/10/Arrival_info_Pack_2024_WUT.pdf
64,Summer schools at WUT?,"Yes, check summerschools.spinaker.pw.edu.pl Sources: https://summerschools.spinaker.pw.edu.pl/International-summer-schools-WUT/FAQ/General-information",Admission & Application,https://summerschools.spinaker.pw.edu.pl/International-summer-schools-WUT/FAQ/General-information
65,Who can apply to summer schools?,"Varies by program Sources: https://summerschools.spinaker.pw.edu.pl/International-summer-schools-WUT/FAQ/General-information",Admission & Application,https://summerschools.spinaker.pw.edu.pl/International-summer-schools-WUT/FAQ/General-information
66,Student-faculty ratio?,"20,000+ students, 5,000+ employees Sources: https://sspw.pl/wp-content/uploads/2024/10/Arrival_info_Pack_2024_WUT.pdf",Admission & Application,https://sspw.pl/wp-content/uploads/2024/10/Arrival_info_Pack_2024_WUT.pdf
67,Online/hybrid programs?,"Yes, some like Applied CS in hybrid mode Sources: https://www.students.pw.edu.pl/Studies-Offer/M.Sc.-offer",Admission & Application,https://www.students.pw.edu.pl/Studies-Offer/M.Sc.-offer
68,Bachelor program duration?,"3.5-4 years (7-8 semesters) Sources: https://www.students.pw.edu.pl/Studies-Offer/M.Sc.-offer",Admission & Application,https://www.students.pw.edu.pl/Studies-Offer/M.Sc.-offer
69,Master program duration?,"3-4 semesters (1.5-2 years) Sources: https://www.students.pw.edu.pl/Studies-Offer/M.Sc.-offer",Admission & Application,https://www.students.pw.edu.pl/Studies-Offer/M.Sc.-offer
70,Double degree possible?,"Yes, joint/double degrees available Sources: https://welcome.uw.edu.pl/how-to-get-student-mobility-instruction/",Admission & Application,https://welcome.uw.edu.pl/how-to-get-student-mobility-instruction/
71,Architecture requirements?,"Portfolio required for admission Sources: https://uczelnia.akademiata.pl/en/recruitment-process-for-wseiz/recruitment-for-international-students/",Admission & Application,https://uczelnia.akademiata.pl/en/recruitment-process-for-wseiz/recruitment-for-international-students/
72,How many English programs?,"24 Master's + multiple Bachelor's programs Sources: https://www.students.pw.edu.pl/Studies-Offer/M.Sc.-offer",Admission & Application,https://www.students.pw.edu.pl/Studies-Offer/M.Sc.-offer
73,What degree upon graduation?,"M.Sc. or B.Sc. + diploma supplement Sources: https://www.students.pw.edu.pl/Studies-Offer/M.Sc.-offer",Admission & Application,https://www.students.pw.edu.pl/Studies-Offer/M.Sc.-offer
74,Second Master's degree?,"Yes, apply as second-cycle candidate Sources: https://bpm.uw.edu.pl/en/everything-you-need-to-know-about-applying-for-dormitory-space-academic-year-2024-2025/",Admission & Application,https://bpm.uw.edu.pl/en/everything-you-need-to-know-about-applying-for-dormitory-space-academic-year-2024-2025/
75,Foreign Bachelor accepted?,"Yes, may need recognition Sources: https://apply.wseiz.pl/en_GB/contents/content/13-new-requirements",Admission & Application,https://apply.wseiz.pl/en_GB/contents/content/13-new-requirements
76,Polish language courses?,"Yes, through Polish Language Centre (OJP) Sources: https://sspw.pl/wp-content/uploads/2024/10/Arrival_info_Pack_2024_WUT.pdf",Admission & Application,https://sspw.pl/wp-content/uploads/2024/10/Arrival_info_Pack_2024_WUT.pdf
77,Study in Polish?,"Yes, with B2 Polish proficiency Sources: https://eng.pw.edu.pl/content/download/4522/37011/file/2022%2004%2028%20Projekt%20dec%20oplaty%20cudzoziemcy_ENG.pdf",Admission & Application,https://eng.pw.edu.pl/content/download/4522/37011/file/2022%2004%2028%20Projekt%20dec%20oplaty%20cudzoziemcy_ENG.pdf
78,What is OJA?,"English Language Centre for preparatory courses Sources: https://sspw.pl/wp-content/uploads/2024/10/Arrival_info_Pack_2024_WUT.pdf",Admission & Application,https://sspw.pl/wp-content/uploads/2024/10/Arrival_info_Pack_2024_WUT.pdf
79,Health insurance checked?,"Upon arrival/registration, not admission Sources: https://welcome.uw.edu.pl/important-information/health-insurance-2/",Admission & Application,https://welcome.uw.edu.pl/important-information/health-insurance-2/
80,Special accommodations?,"Contact Dean's Office/Vice-Dean Sources: https://sspw.pl/wp-content/uploads/2024/10/Arrival_info_Pack_2024_WUT.pdf",Admission & Application,https://sspw.pl/wp-content/uploads/2024/10/Arrival_info_Pack_2024_WUT.pdf
81,Do EU students pay tuition?,"EU/EFTA citizens often don't pay for full-time English programs Sources: https://eng.pw.edu.pl/content/download/4522/37011/file/2022%2004%2028%20Projekt%20dec%20oplaty%20cudzoziemcy_ENG.pdf",Tuition & Financial,https://eng.pw.edu.pl/content/download/4522/37011/file/2022%2004%2028%20Projekt%20dec%20oplaty%20cudzoziemcy_ENG.pdf
82,M.Sc. tuition for non-EU?,"€2,750-€6,795/semester depending on program Sources: https://www.students.pw.edu.pl/Studies-Offer/M.Sc.-offer",Tuition & Financial,https://www.students.pw.edu.pl/Studies-Offer/M.Sc.-offer
83,Scholarships available?,"Yes, Rector's Scholarship and others Sources: https://www.students.pw.edu.pl/Resources/Students-Life/Scholarships",Tuition & Financial,https://www.students.pw.edu.pl/Resources/Students-Life/Scholarships
84,What is Stefan Banach Scholarship?,"Scholarship program for international students Sources: https://www.students.pw.edu.pl/Resources/Students-Life/Scholarships",Tuition & Financial,https://www.students.pw.edu.pl/Resources/Students-Life/Scholarships
85,Retake course costs?,"PLN 11/hour tutorials, PLN 90 lectures, PLN 220/390 thesis consultations Sources: https://eng.pw.edu.pl/content/download/4522/37011/file/2022%2004%2028%20Projekt%20dec%20oplaty%20cudzoziemcy_ENG.pdf",Tuition & Financial,https://eng.pw.edu.pl/content/download/4522/37011/file/2022%2004%2028%20Projekt%20dec%20oplaty%20cudzoziemcy_ENG.pdf
86,Refund policy?,"Check WUT website M.Sc. offer page Sources: https://www.students.pw.edu.pl/Studies-Offer/M.Sc.-offer",Tuition & Financial,https://www.students.pw.edu.pl/Studies-Offer/M.Sc.-offer
87,B2 exam cost?,"Free for WUT students, first language. PLN 153 for additional languages Sources: https://www.sjo.pw.edu.pl/faq/",Tuition & Financial,https://www.sjo.pw.edu.pl/faq/
88,Language course fees?,"PLN 102 qualification, PLN 34/hour courses Sources: https://eng.pw.edu.pl/content/download/4522/37011/file/2022%2004%2028%20Projekt%20dec%20oplaty%20cudzoziemcy_ENG.pdf",Tuition & Financial,https://eng.pw.edu.pl/content/download/4522/37011/file/2022%2004%2028%20Projekt%20dec%20oplaty%20cudzoziemcy_ENG.pdf
89,Student ID cost?,"PLN 22 (~5 EUR) Sources: https://welcome.uw.edu.pl/during-your-stay/your-electronic-student-card/ | https://sspw.pl/wp-content/uploads/2024/10/Arrival_info_Pack_2024_WUT.pdf",Tuition & Financial,https://welcome.uw.edu.pl/during-your-stay/your-electronic-student-card/ | https://sspw.pl/wp-content/uploads/2024/10/Arrival_info_Pack_2024_WUT.pdf
90,Can students work?,"Depends on visa type Sources: https://www.sjo.pw.edu.pl/wut/participants/faq/",Tuition & Financial,https://www.sjo.pw.edu.pl/wut/participants/faq/
91,Payment methods?,"Bank transfer to WUT account Sources: https://eng.pw.edu.pl/content/download/4522/37011/file/2022%2004%2028%20Projekt%20dec%20oplaty%20cudzoziemcy_ENG.pdf",Tuition & Financial,https://eng.pw.edu.pl/content/download/4522/37011/file/2022%2004%2028%20Projekt%20dec%20oplaty%20cudzoziemcy_ENG.pdf
92,Payment plans?,"Contact Accountancy Office Sources: https://uczelnia.akademiata.pl/en/recruitment-process-for-wseiz/recruitment-for-international-students/",Tuition & Financial,https://uczelnia.akademiata.pl/en/recruitment-process-for-wseiz/recruitment-for-international-students/
93,Duplicate ID cost?,"Additional fee, check Dean's Office Sources: https://www.sjo.pw.edu.pl/wut/participants/faq/",Tuition & Financial,https://www.sjo.pw.edu.pl/wut/participants/faq/
94,Financial aid for living?,"Various scholarships available Sources: https://sspw.pl/wp-content/uploads/2024/10/Arrival_info_Pack_2024_WUT.pdf",Tuition & Financial,https://sspw.pl/wp-content/uploads/2024/10/Arrival_info_Pack_2024_WUT.pdf
95,Scholarship holders pay tuition?,"Depends on scholarship terms Sources: https://www.students.pw.edu.pl/Resources/Students-Life/Scholarships",Tuition & Financial,https://www.students.pw.edu.pl/Resources/Students-Life/Scholarships
96,Diploma supplement cost?,"Free with graduation, fees for extra copies Sources: https://eng.pw.edu.pl/content/download/4522/37011/file/2022%2004%2028%20Projekt%20dec%20oplaty%20cudzoziemcy_ENG.pdf",Tuition & Financial,https://eng.pw.edu.pl/content/download/4522/37011/file/2022%2004%2028%20Projekt%20dec%20oplaty%20cudzoziemcy_ENG.pdf
97,Transport discount over 26?,"No, valid for BA/MA under 26, PhD under 35 Sources: https://welcome.uw.edu.pl/during-your-stay/your-electronic-student-card/",Tuition & Financial,https://welcome.uw.edu.pl/during-your-stay/your-electronic-student-card/
98,Polish course costs?,"Contact OJP at ojp.sjo@pw.edu.pl Sources: https://sspw.pl/wp-content/uploads/2024/10/Arrival_info_Pack_2024_WUT.pdf",Tuition & Financial,https://sspw.pl/wp-content/uploads/2024/10/Arrival_info_Pack_2024_WUT.pdf
99,Transcript fees?,"Some free, certified copies may have fees Sources: https://sspw.pl/wp-content/uploads/2024/10/Arrival_info_Pack_2024_WUT.pdf",Tuition & Financial,https://sspw.pl/wp-content/uploads/2024/10/Arrival_info_Pack_2024_WUT.pdf
100,Dormitory costs?,"Varies by location/type, check ESKS Sources: https://sspw.pl/wp-content/uploads/2024/10/Arrival_info_Pack_2024_WUT.pdf",Tuition & Financial,https://sspw.pl/wp-content/uploads/2024/10/Arrival_info_Pack_2024_WUT.pdf
101,Semester payment?,"Typically per semester Sources: https://eng.pw.edu.pl/content/download/4522/37011/file/2022%2004%2028%20Projekt%20dec%20oplaty%20cudzoziemcy_ENG.pdf",Tuition & Financial,https://eng.pw.edu.pl/content/download/4522/37011/file/2022%2004%2028%20Projekt%20dec%20oplaty%20cudzoziemcy_ENG.pdf
102,Late payment penalties?,"Contact Accountancy Office Sources: https://uczelnia.akademiata.pl/en/recruitment-process-for-wseiz/recruitment-for-international-students/",Tuition & Financial,https://uczelnia.akademiata.pl/en/recruitment-process-for-wseiz/recruitment-for-international-students/
103,Scholarship application deadline?,"Varies, check after first year completion Sources: https://www.students.pw.edu.pl/Resources/Students-Life/Scholarships",Tuition & Financial,https://www.students.pw.edu.pl/Resources/Students-Life/Scholarships
104,Polish Government Scholarship?,"Through NAWA, covers tuition/living Sources: https://rekrutacja.pwr.edu.pl/en/for-foreigners/fee-paying-basis-of-studies-and-scholarship-holders/admission/scholarship-progra",Tuition & Financial,https://rekrutacja.pwr.edu.pl/en/for-foreigners/fee-paying-basis-of-studies-and-scholarship-holders/admission/scholarship-progra
105,Rector's Scholarship requirements?,"High grades or achievements in science/sports/arts Sources: https://rekrutacja.pwr.edu.pl/en/for-foreigners/fee-paying-basis-of-studies-and-scholarship-holders/admission/scholarship-progra",Tuition & Financial,https://rekrutacja.pwr.edu.pl/en/for-foreigners/fee-paying-basis-of-studies-and-scholarship-holders/admission/scholarship-progra
