ID,Question,Answer,Category,Source_URLs
206,Study break maximum?,"Check with Faculty Sources: https://www.is.pw.edu.pl/images/regulaminy/Academic_Regulations_at_the_Warsaw_University_of_Technology.pdf",Academic Life & Studies,https://www.is.pw.edu.pl/images/regulaminy/Academic_Regulations_at_the_Warsaw_University_of_Technology.pdf
207,Part-time work allowance?,"Depends on visa type Sources: https://www.sjo.pw.edu.pl/wut/participants/faq/",Academic Life & Studies,https://www.sjo.pw.edu.pl/wut/participants/faq/
208,Final exam exemptions?,"Rare, only special circumstances Sources: https://www.is.pw.edu.pl/images/regulaminy/Academic_Regulations_at_the_Warsaw_University_of_Technology.pdf",Academic Life & Studies,https://www.is.pw.edu.pl/images/regulaminy/Academic_Regulations_at_the_Warsaw_University_of_Technology.pdf
209,Course equivalency?,"Evaluated by Faculty for transfers Sources: https://bok.uw.edu.pl/the-rules-and-regulations-of-study-faq/",Academic Life & Studies,https://bok.uw.edu.pl/the-rules-and-regulations-of-study-faq/
210,Syllabus availability?,"In USOS and announced first class Sources: https://sspw.pl/wp-content/uploads/2024/10/Arrival_info_Pack_2024_WUT.pdf",Academic Life & Studies,https://sspw.pl/wp-content/uploads/2024/10/Arrival_info_Pack_2024_WUT.pdf
211,English-medium students need English courses?,"Yes, C1 Academic unless exempted by certificate Sources: https://www.sjo.pw.edu.pl/studies-in-english/other/faq/",Language Requirements,https://www.sjo.pw.edu.pl/studies-in-english/other/faq/
212,C1 exemption certificates?,"IELTS 7.5+, TOEFL 100-120, C2/C1 Cambridge, IB Diploma Sources: https://www.sjo.pw.edu.pl/studies-in-english/other/faq/",Language Requirements,https://www.sjo.pw.edu.pl/studies-in-english/other/faq/
213,Foreign language hours required?,"180 hours total minus C1 Academic hours Sources: https://www.sjo.pw.edu.pl/studies-in-english/other/faq/",Language Requirements,https://www.sjo.pw.edu.pl/studies-in-english/other/faq/
214,Register C1 certificate?,"Email scan to Joanna.szymanska@pw.edu.pl Sources: https://www.sjo.pw.edu.pl/studies-in-english/other/faq/",Language Requirements,https://www.sjo.pw.edu.pl/studies-in-english/other/faq/
215,Placement Test needed?,"Depends on faculty, available on PW Moodle Sources: https://www.sjo.pw.edu.pl/studies-in-english/other/faq/",Language Requirements,https://www.sjo.pw.edu.pl/studies-in-english/other/faq/
216,C1 Exam timing?,"Three times yearly: winter/summer sessions + September Sources: https://www.sjo.pw.edu.pl/studies-in-english/other/faq/",Language Requirements,https://www.sjo.pw.edu.pl/studies-in-english/other/faq/
217,Start other languages before passing C1?,"No, must pass both written and speaking C1 first Sources: https://www.sjo.pw.edu.pl/studies-in-english/other/faq/",Language Requirements,https://www.sjo.pw.edu.pl/studies-in-english/other/faq/
218,Register for language courses?,"Via USOS, 2 weeks before semester Sources: https://sspw.pl/wp-content/uploads/2024/10/Arrival_info_Pack_2024_WUT.pdf",Language Requirements,https://sspw.pl/wp-content/uploads/2024/10/Arrival_info_Pack_2024_WUT.pdf
219,What is SJO?,"Foreign Language Centre at Pl. Politechniki 1, room 419 Sources: https://sspw.pl/wp-content/uploads/2024/10/Arrival_info_Pack_2024_WUT.pdf",Language Requirements,https://sspw.pl/wp-content/uploads/2024/10/Arrival_info_Pack_2024_WUT.pdf
220,Languages beyond English?,"Yes, various European and world languages Sources: https://www.sjo.pw.edu.pl/studies-in-english/other/faq/",Language Requirements,https://www.sjo.pw.edu.pl/studies-in-english/other/faq/
221,Automatic English registration?,"Yes if no C1 certificate Sources: https://www.sjo.pw.edu.pl/studies-in-english/other/faq/",Language Requirements,https://www.sjo.pw.edu.pl/studies-in-english/other/faq/
222,Language course levels?,"A1 to C2, divided into modules Sources: https://www.sjo.pw.edu.pl/student/na-biezaco/faq-zapisy/",Language Requirements,https://www.sjo.pw.edu.pl/student/na-biezaco/faq-zapisy/
223,How many language modules?,"Multiple modules per level Sources: https://www.sjo.pw.edu.pl/student/na-biezaco/faq-zapisy/",Language Requirements,https://www.sjo.pw.edu.pl/student/na-biezaco/faq-zapisy/
224,Which module to choose?,"Based on Placement Test result Sources: https://www.sjo.pw.edu.pl/student/na-biezaco/faq-zapisy/",Language Requirements,https://www.sjo.pw.edu.pl/student/na-biezaco/faq-zapisy/
225,Language hours per semester?,"Varies by study program Sources: https://www.sjo.pw.edu.pl/student/na-biezaco/faq-zapisy/",Language Requirements,https://www.sjo.pw.edu.pl/student/na-biezaco/faq-zapisy/
226,Split language hours across semesters?,"Possible, but affects ECTS progression Sources: https://www.sjo.pw.edu.pl/student/na-biezaco/faq-zapisy/",Language Requirements,https://www.sjo.pw.edu.pl/student/na-biezaco/faq-zapisy/
227,Thematic language courses?,"Available after B2, choose level based on your proficiency Sources: https://www.sjo.pw.edu.pl/student/na-biezaco/faq-zapisy/",Language Requirements,https://www.sjo.pw.edu.pl/student/na-biezaco/faq-zapisy/
228,Failed modules next steps?,"Repeat or with Director permission try different language Sources: https://www.sjo.pw.edu.pl/student/na-biezaco/faq-zapisy/",Language Requirements,https://www.sjo.pw.edu.pl/student/na-biezaco/faq-zapisy/
229,Language exam costs?,"B2 free for first language, 153 PLN additional Sources: https://www.sjo.pw.edu.pl/faq/",Language Requirements,https://www.sjo.pw.edu.pl/faq/
230,Retake language exam?,"Yes, multiple attempts allowed Sources: https://www.sjo.pw.edu.pl/faq/",Language Requirements,https://www.sjo.pw.edu.pl/faq/
231,Documents for language exam?,"Student ID + second photo ID Sources: https://www.sjo.pw.edu.pl/faq/",Language Requirements,https://www.sjo.pw.edu.pl/faq/
232,Language course registration deadline?,"2 weeks before semester, check SJO website Sources: https://sspw.pl/wp-content/uploads/2024/10/Arrival_info_Pack_2024_WUT.pdf",Language Requirements,https://sspw.pl/wp-content/uploads/2024/10/Arrival_info_Pack_2024_WUT.pdf
233,Can audit language courses?,"No, must register and complete for credits Sources: https://www.sjo.pw.edu.pl/student/na-biezaco/faq-zapisy/",Language Requirements,https://www.sjo.pw.edu.pl/student/na-biezaco/faq-zapisy/
234,Language course attendance?,"Mandatory, affects final grade Sources: https://www.sjo.pw.edu.pl/wut/participants/faq/",Language Requirements,https://www.sjo.pw.edu.pl/wut/participants/faq/
235,Polish for internationals?,"Offered through OJP, various levels Sources: https://sspw.pl/wp-content/uploads/2024/10/Arrival_info_Pack_2024_WUT.pdf",Language Requirements,https://sspw.pl/wp-content/uploads/2024/10/Arrival_info_Pack_2024_WUT.pdf
236,Business English available?,"Yes, as thematic language course Sources: https://www.sjo.pw.edu.pl/student/na-biezaco/faq-zapisy/",Language Requirements,https://www.sjo.pw.edu.pl/student/na-biezaco/faq-zapisy/
237,Technical English?,"Yes, field-specific courses available Sources: https://www.sjo.pw.edu.pl/student/na-biezaco/faq-zapisy/",Language Requirements,https://www.sjo.pw.edu.pl/student/na-biezaco/faq-zapisy/
238,Language exchange programs?,"Check with SJO or ESN Sources: https://sspw.pl/wp-content/uploads/2024/10/Arrival_info_Pack_2024_WUT.pdf",Language Requirements,https://sspw.pl/wp-content/uploads/2024/10/Arrival_info_Pack_2024_WUT.pdf
239,Native speaker teachers?,"Many courses taught by native speakers Sources: https://sspw.pl/wp-content/uploads/2024/10/Arrival_info_Pack_2024_WUT.pdf",Language Requirements,https://sspw.pl/wp-content/uploads/2024/10/Arrival_info_Pack_2024_WUT.pdf
240,Online language courses?,"Some available, especially during pandemic Sources: https://leon.pw.edu.pl/?lang=en",Language Requirements,https://leon.pw.edu.pl/?lang=en
241,Summer language courses?,"Limited availability, check SJO Sources: https://www.sjo.pw.edu.pl/student/na-biezaco/faq-zapisy/",Language Requirements,https://www.sjo.pw.edu.pl/student/na-biezaco/faq-zapisy/
242,Certificate upon language completion?,"Yes, after passing exam Sources: https://www.sjo.pw.edu.pl/faq/",Language Requirements,https://www.sjo.pw.edu.pl/faq/
243,Language certification validity?,"Check specific certificate validity Sources: https://www.students.pw.edu.pl/Resources/Application-Glossary/English-Proficiency",Language Requirements,https://www.students.pw.edu.pl/Resources/Application-Glossary/English-Proficiency
244,English for academic purposes?,"C1 Academic English course focus Sources: https://www.sjo.pw.edu.pl/studies-in-english/other/faq/",Language Requirements,https://www.sjo.pw.edu.pl/studies-in-english/other/faq/
245,Conversation practice sessions?,"Available through language courses Sources: https://www.sjo.pw.edu.pl/student/na-biezaco/faq-zapisy/",Language Requirements,https://www.sjo.pw.edu.pl/student/na-biezaco/faq-zapisy/
246,Language tutoring available?,"Through SJO or private tutors Sources: https://sspw.pl/wp-content/uploads/2024/10/Arrival_info_Pack_2024_WUT.pdf",Language Requirements,https://sspw.pl/wp-content/uploads/2024/10/Arrival_info_Pack_2024_WUT.pdf
247,Change language mid-course?,"Generally not allowedSources: https://www.sjo.pw.edu.pl/wut/participants/faq/",Language Requirements,https://www.sjo.pw.edu.pl/wut/participants/faq/
248,Language requirement for graduation?,"Must complete all required language hours Sources: https://www.sjo.pw.edu.pl/studies-in-english/other/faq/",Language Requirements,https://www.sjo.pw.edu.pl/studies-in-english/other/faq/
249,EiTI language requirements?,"ELAN1, ELAN2, EACAW, ECULT obligatory Sources: https://www.sjo.pw.edu.pl/studies-in-english/other/faq/",Language Requirements,https://www.sjo.pw.edu.pl/studies-in-english/other/faq/
250,Conditional C1 oral exam?,"FLC Director may grant if failed written Sources: https://www.sjo.pw.edu.pl/studies-in-english/second-cycle-students-msc/general-information/",Language Requirements,https://www.sjo.pw.edu.pl/studies-in-english/second-cycle-students-msc/general-information/
251,C1 course without certificate?,"Must apply through coordinator Sources: https://www.sjo.pw.edu.pl/studies-in-english/second-cycle-students-msc/general-information/",Language Requirements,https://www.sjo.pw.edu.pl/studies-in-english/second-cycle-students-msc/general-information/
252,Second-cycle language requirements?,"May need C1 certificate, check faculty Sources: https://www.sjo.pw.edu.pl/studies-in-english/second-cycle-students-msc/general-information/",Language Requirements,https://www.sjo.pw.edu.pl/studies-in-english/second-cycle-students-msc/general-information/
253,LanguageCert accepted?,"Yes, Level 1 Communicator B2 or higher Sources: https://www.students.pw.edu.pl/Resources/Application-Glossary/English-Proficiency",Language Requirements,https://www.students.pw.edu.pl/Resources/Application-Glossary/English-Proficiency
254,TOEIC accepted?,"Check current accepted certificates list Sources: https://apply.wseiz.pl/en_GB/contents/content/13-new-requirements",Language Requirements,https://apply.wseiz.pl/en_GB/contents/content/13-new-requirements
255,Language proficiency proof?,"Certificate or Language Proficiency Form from university Sources: https://bwz.uw.edu.pl/en/incoming/students-and-phd-candidates-incoming/short-term-studies-incoming/incoming-students/before-you-",Language Requirements,https://bwz.uw.edu.pl/en/incoming/students-and-phd-candidates-incoming/short-term-studies-incoming/incoming-students/before-you-
256,How many WUT campuses?,"3: Main (central Warsaw), Southern (15min away), Płock (100km) Sources: https://sspw.pl/wp-content/uploads/2024/10/Arrival_info_Pack_2024_WUT.pdf",Student Services & Facilities,https://sspw.pl/wp-content/uploads/2024/10/Arrival_info_Pack_2024_WUT.pdf
257,Main Building address?,"Plac Politechniki 1, 00-661 Warszawa Sources: https://sspw.pl/wp-content/uploads/2024/10/Arrival_info_Pack_2024_WUT.pdf",Student Services & Facilities,https://sspw.pl/wp-content/uploads/2024/10/Arrival_info_Pack_2024_WUT.pdf
258,Get to WUT from airport?,"Bus 188, ~30 min, use JAKDOJADE app Sources: https://sspw.pl/wp-content/uploads/2024/10/Arrival_info_Pack_2024_WUT.pdf",Student Services & Facilities,https://sspw.pl/wp-content/uploads/2024/10/Arrival_info_Pack_2024_WUT.pdf
259,Student ID as library card?,"Yes, use for Main Library and borrowing Sources: https://bg.pw.edu.pl/index.php/en/library-account",Student Services & Facilities,https://bg.pw.edu.pl/index.php/en/library-account
260,Student ID discounts?,"50% Warsaw transport, 51% trains (under 26), 37% buses (under 26) Sources: https://sspw.pl/wp-content/uploads/2024/10/Arrival_info_Pack_2024_WUT.pdf",Student Services & Facilities,https://sspw.pl/wp-content/uploads/2024/10/Arrival_info_Pack_2024_WUT.pdf
261,What is CenterMed?,"Student Medical Centre, 5 Warsaw locations, +48 22 592 48 30 Sources: https://sspw.pl/wp-content/uploads/2024/10/Arrival_info_Pack_2024_WUT.pdf",Student Services & Facilities,https://sspw.pl/wp-content/uploads/2024/10/Arrival_info_Pack_2024_WUT.pdf
262,Psychological support available?,"Yes, free psychological assistance program for all students Sources: https://sspw.pl/wp-content/uploads/2024/10/Arrival_info_Pack_2024_WUT.pdf",Student Services & Facilities,https://sspw.pl/wp-content/uploads/2024/10/Arrival_info_Pack_2024_WUT.pdf
263,Main Library location?,"In Main Building of WUT Sources: https://sspw.pl/wp-content/uploads/2024/10/Arrival_info_Pack_2024_WUT.pdf",Student Services & Facilities,https://sspw.pl/wp-content/uploads/2024/10/Arrival_info_Pack_2024_WUT.pdf
264,Microsoft services for students?,"Office 365 and Azure platform access Sources: https://sspw.pl/wp-content/uploads/2024/10/Arrival_info_Pack_2024_WUT.pdf",Student Services & Facilities,https://sspw.pl/wp-content/uploads/2024/10/Arrival_info_Pack_2024_WUT.pdf
265,Careers Service location?,"Polna 50, room 502, biurokarier@pw.edu.pl Sources: https://sspw.pl/wp-content/uploads/2024/10/Arrival_info_Pack_2024_WUT.pdf",Student Services & Facilities,https://sspw.pl/wp-content/uploads/2024/10/Arrival_info_Pack_2024_WUT.pdf
266,Nearest metro station?,"Politechnika station, Metro Line 1 Sources: https://sspw.pl/wp-content/uploads/2024/10/Arrival_info_Pack_2024_WUT.pdf",Student Services & Facilities,https://sspw.pl/wp-content/uploads/2024/10/Arrival_info_Pack_2024_WUT.pdf
267,Campus WiFi access?,"Available with USOS credentials Sources: https://sspw.pl/wp-content/uploads/2024/10/Arrival_info_Pack_2024_WUT.pdf",Student Services & Facilities,https://sspw.pl/wp-content/uploads/2024/10/Arrival_info_Pack_2024_WUT.pdf
268,Student organizations?,"Multiple science groups and student unions Sources: https://sspw.pl/wp-content/uploads/2024/10/Arrival_info_Pack_2024_WUT.pdf",Student Services & Facilities,https://sspw.pl/wp-content/uploads/2024/10/Arrival_info_Pack_2024_WUT.pdf
269,What is SSPW?,"Students' Union, student government Sources: https://sspw.pl/wp-content/uploads/2024/10/Arrival_info_Pack_2024_WUT.pdf",Student Services & Facilities,https://sspw.pl/wp-content/uploads/2024/10/Arrival_info_Pack_2024_WUT.pdf
270,What is ESN?,"Erasmus Student Network for international students Sources: https://sspw.pl/wp-content/uploads/2024/10/Arrival_info_Pack_2024_WUT.pdf",Student Services & Facilities,https://sspw.pl/wp-content/uploads/2024/10/Arrival_info_Pack_2024_WUT.pdf
271,ESN Buddy Program contact?,"buddy.pw@esn.pl, papaya.iter-idea.com Sources: https://sspw.pl/wp-content/uploads/2024/10/Arrival_info_Pack_2024_WUT.pdf",Student Services & Facilities,https://sspw.pl/wp-content/uploads/2024/10/Arrival_info_Pack_2024_WUT.pdf
272,Sports facilities?,"SWFIS Centre for PE and Sport Sources: https://sspw.pl/wp-content/uploads/2024/10/Arrival_info_Pack_2024_WUT.pdf",Student Services & Facilities,https://sspw.pl/wp-content/uploads/2024/10/Arrival_info_Pack_2024_WUT.pdf
273,PE courses required?,"Yes, register via USOS Sources: https://sspw.pl/wp-content/uploads/2024/10/Arrival_info_Pack_2024_WUT.pdf",Student Services & Facilities,https://sspw.pl/wp-content/uploads/2024/10/Arrival_info_Pack_2024_WUT.pdf
274,Cafeterias on campus?,"Yes, in main and faculty buildings Sources: https://sspw.pl/wp-content/uploads/2024/10/Arrival_info_Pack_2024_WUT.pdf",Student Services & Facilities,https://sspw.pl/wp-content/uploads/2024/10/Arrival_info_Pack_2024_WUT.pdf
275,Student discounts in Warsaw?,"Many with valid Student ID Sources: https://sspw.pl/wp-content/uploads/2024/10/Arrival_info_Pack_2024_WUT.pdf",Student Services & Facilities,https://sspw.pl/wp-content/uploads/2024/10/Arrival_info_Pack_2024_WUT.pdf
276,Campus security?,"Security offices in main buildings Sources: https://sspw.pl/wp-content/uploads/2024/10/Arrival_info_Pack_2024_WUT.pdf",Student Services & Facilities,https://sspw.pl/wp-content/uploads/2024/10/Arrival_info_Pack_2024_WUT.pdf
277,Lost and found?,"Check with building security office Sources: https://sspw.pl/wp-content/uploads/2024/10/Arrival_info_Pack_2024_WUT.pdf",Student Services & Facilities,https://sspw.pl/wp-content/uploads/2024/10/Arrival_info_Pack_2024_WUT.pdf
278,Disability services?,"Contact Dean's Office for accommodations Sources: https://sspw.pl/wp-content/uploads/2024/10/Arrival_info_Pack_2024_WUT.pdf",Student Services & Facilities,https://sspw.pl/wp-content/uploads/2024/10/Arrival_info_Pack_2024_WUT.pdf
279,Study abroad office?,"Erasmus Office and CWM International Office Sources: https://sspw.pl/wp-content/uploads/2024/10/Arrival_info_Pack_2024_WUT.pdf",Student Services & Facilities,https://sspw.pl/wp-content/uploads/2024/10/Arrival_info_Pack_2024_WUT.pdf
280,Student ID photo requirements?,"Digital headshot for electronic card Sources: https://sspw.pl/wp-content/uploads/2024/10/Arrival_info_Pack_2024_WUT.pdf",Student Services & Facilities,https://sspw.pl/wp-content/uploads/2024/10/Arrival_info_Pack_2024_WUT.pdf
281,ID card collection?,"From Dean's Office at your Faculty Sources: https://sspw.pl/wp-content/uploads/2024/10/Arrival_info_Pack_2024_WUT.pdf",Student Services & Facilities,https://sspw.pl/wp-content/uploads/2024/10/Arrival_info_Pack_2024_WUT.pdf
282,ID card validation?,"Stickers each semester from Dean's Office Sources: https://sspw.pl/wp-content/uploads/2024/10/Arrival_info_Pack_2024_WUT.pdf",Student Services & Facilities,https://sspw.pl/wp-content/uploads/2024/10/Arrival_info_Pack_2024_WUT.pdf
283,mLegitymacja available?,"Yes, electronic ID in mObywatel app with PESEL Sources: https://welcome.uw.edu.pl/during-your-stay/your-electronic-student-card/",Student Services & Facilities,https://welcome.uw.edu.pl/during-your-stay/your-electronic-student-card/
284,Campus map available?,"Yes, in Arrival Info Pack and on website Sources: https://sspw.pl/wp-content/uploads/2024/10/Arrival_info_Pack_2024_WUT.pdf",Student Services & Facilities,https://sspw.pl/wp-content/uploads/2024/10/Arrival_info_Pack_2024_WUT.pdf
285,Faculty locations?,"Main: Pl. Politechniki 1; others: Narbutta, Koszykowa, etc. Sources: https://sspw.pl/wp-content/uploads/2024/10/Arrival_info_Pack_2024_WUT.pdf",Student Services & Facilities,https://sspw.pl/wp-content/uploads/2024/10/Arrival_info_Pack_2024_WUT.pdf
286,Emergency phone numbers?,"112 (universal), check Polish emergency numbers Sources: https://sspw.pl/wp-content/uploads/2024/10/Arrival_info_Pack_2024_WUT.pdf",Student Services & Facilities,https://sspw.pl/wp-content/uploads/2024/10/Arrival_info_Pack_2024_WUT.pdf
287,Health emergencies on campus?,"Call 112, inform security Sources: https://sspw.pl/wp-content/uploads/2024/10/Arrival_info_Pack_2024_WUT.pdf",Student Services & Facilities,https://sspw.pl/wp-content/uploads/2024/10/Arrival_info_Pack_2024_WUT.pdf
288,Pharmacies near campus?,"Multiple in Warsaw, some 24/7 Sources: https://sspw.pl/wp-content/uploads/2024/10/Arrival_info_Pack_2024_WUT.pdf",Student Services & Facilities,https://sspw.pl/wp-content/uploads/2024/10/Arrival_info_Pack_2024_WUT.pdf
289,Banks near WUT?,"Several banks around Main Campus Sources: https://sspw.pl/wp-content/uploads/2024/10/Arrival_info_Pack_2024_WUT.pdf",Student Services & Facilities,https://sspw.pl/wp-content/uploads/2024/10/Arrival_info_Pack_2024_WUT.pdf
290,ATMs on campus?,"Available in main buildings Sources: https://sspw.pl/wp-content/uploads/2024/10/Arrival_info_Pack_2024_WUT.pdf",Student Services & Facilities,https://sspw.pl/wp-content/uploads/2024/10/Arrival_info_Pack_2024_WUT.pdf
291,Bike parking?,"Available at campuses Sources: https://sspw.pl/wp-content/uploads/2024/10/Arrival_info_Pack_2024_WUT.pdf",Student Services & Facilities,https://sspw.pl/wp-content/uploads/2024/10/Arrival_info_Pack_2024_WUT.pdf
292,Public transport card?,"Student ID works as transport card Sources: https://sspw.pl/wp-content/uploads/2024/10/Arrival_info_Pack_2024_WUT.pdf",Student Services & Facilities,https://sspw.pl/wp-content/uploads/2024/10/Arrival_info_Pack_2024_WUT.pdf
293,Validate transport card?,"Ensure ID has current semester sticker Sources: https://sspw.pl/wp-content/uploads/2024/10/Arrival_info_Pack_2024_WUT.pdf",Student Services & Facilities,https://sspw.pl/wp-content/uploads/2024/10/Arrival_info_Pack_2024_WUT.pdf
294,Student events?,"Organized by SSPW and ESN regularly Sources: https://sspw.pl/wp-content/uploads/2024/10/Arrival_info_Pack_2024_WUT.pdf",Student Services & Facilities,https://sspw.pl/wp-content/uploads/2024/10/Arrival_info_Pack_2024_WUT.pdf
295,Clubs and societies?,"Various technical, cultural, sports Sources: https://sspw.pl/wp-content/uploads/2024/10/Arrival_info_Pack_2024_WUT.pdf",Student Services & Facilities,https://sspw.pl/wp-content/uploads/2024/10/Arrival_info_Pack_2024_WUT.pdf
296,Volunteer opportunities?,"Through student organizations Sources: https://sspw.pl/wp-content/uploads/2024/10/Arrival_info_Pack_2024_WUT.pdf",Student Services & Facilities,https://sspw.pl/wp-content/uploads/2024/10/Arrival_info_Pack_2024_WUT.pdf
297,International student association?,"ESN WUT Warsaw Sources: https://sspw.pl/wp-content/uploads/2024/10/Arrival_info_Pack_2024_WUT.pdf",Student Services & Facilities,https://sspw.pl/wp-content/uploads/2024/10/Arrival_info_Pack_2024_WUT.pdf
298,Cultural events?,"Regular events organized on campus Sources: https://sspw.pl/wp-content/uploads/2024/10/Arrival_info_Pack_2024_WUT.pdf",Student Services & Facilities,https://sspw.pl/wp-content/uploads/2024/10/Arrival_info_Pack_2024_WUT.pdf
299,Sports competitions?,"University and inter-university Sources: https://sspw.pl/wp-content/uploads/2024/10/Arrival_info_Pack_2024_WUT.pdf",Student Services & Facilities,https://sspw.pl/wp-content/uploads/2024/10/Arrival_info_Pack_2024_WUT.pdf
300,Music groups?,"Student music clubs available Sources: https://sspw.pl/wp-content/uploads/2024/10/Arrival_info_Pack_2024_WUT.pdf",Student Services & Facilities,https://sspw.pl/wp-content/uploads/2024/10/Arrival_info_Pack_2024_WUT.pdf
301,Theater groups?,"Check SSPW for activities Sources: https://sspw.pl/wp-content/uploads/2024/10/Arrival_info_Pack_2024_WUT.pdf",Student Services & Facilities,https://sspw.pl/wp-content/uploads/2024/10/Arrival_info_Pack_2024_WUT.pdf
302,Student newspaper?,"Check SSPW for publications Sources: https://sspw.pl/wp-content/uploads/2024/10/Arrival_info_Pack_2024_WUT.pdf",Student Services & Facilities,https://sspw.pl/wp-content/uploads/2024/10/Arrival_info_Pack_2024_WUT.pdf
303,Academic conferences?,"Student conferences in various fields Sources: https://sspw.pl/wp-content/uploads/2024/10/Arrival_info_Pack_2024_WUT.pdf",Student Services & Facilities,https://sspw.pl/wp-content/uploads/2024/10/Arrival_info_Pack_2024_WUT.pdf
304,Networking events?,"Career Service and faculty-organized Sources: https://sspw.pl/wp-content/uploads/2024/10/Arrival_info_Pack_2024_WUT.pdf",Student Services & Facilities,https://sspw.pl/wp-content/uploads/2024/10/Arrival_info_Pack_2024_WUT.pdf
305,Alumni events?,"Through faculties and university Sources: https://sspw.pl/wp-content/uploads/2024/10/Arrival_info_Pack_2024_WUT.pdf",Student Services & Facilities,https://sspw.pl/wp-content/uploads/2024/10/Arrival_info_Pack_2024_WUT.pdf
306,How many WUT dormitories?,"11 dormitories across Warsaw Sources: https://sspw.pl/wp-content/uploads/2024/10/Arrival_info_Pack_2024_WUT.pdf",Accommodation & Housing,https://sspw.pl/wp-content/uploads/2024/10/Arrival_info_Pack_2024_WUT.pdf
307,Apply for dormitory?,"Through ESKS at esks.pw.edu.pl Sources: https://sspw.pl/wp-content/uploads/2024/10/Arrival_info_Pack_2024_WUT.pdf",Accommodation & Housing,https://sspw.pl/wp-content/uploads/2024/10/Arrival_info_Pack_2024_WUT.pdf
308,Extend dormitory accommodation?,"Yes, must extend for summer and next semesters Sources: https://sspw.pl/wp-content/uploads/2024/10/Arrival_info_Pack_2024_WUT.pdf",Accommodation & Housing,https://sspw.pl/wp-content/uploads/2024/10/Arrival_info_Pack_2024_WUT.pdf
309,Dormitory check-in times?,"Weekdays during daytime, contact for other times Sources: https://sspw.pl/wp-content/uploads/2024/10/Arrival_info_Pack_2024_WUT.pdf",Accommodation & Housing,https://sspw.pl/wp-content/uploads/2024/10/Arrival_info_Pack_2024_WUT.pdf
310,Find dormitory assignment?,"Accommodation certificate in Online Application System Sources: https://sspw.pl/wp-content/uploads/2024/10/Arrival_info_Pack_2024_WUT.pdf",Accommodation & Housing,https://sspw.pl/wp-content/uploads/2024/10/Arrival_info_Pack_2024_WUT.pdf
311,Dormitory contact?,"centrum.kwaterunkowe@pw.edu.pl Sources: https://sspw.pl/wp-content/uploads/2024/10/Arrival_info_Pack_2024_WUT.pdf",Accommodation & Housing,https://sspw.pl/wp-content/uploads/2024/10/Arrival_info_Pack_2024_WUT.pdf
312,DS Akademik address?,"Akademicka 5, 02-038 Warsaw, 22 234 44 16 Sources: https://sspw.pl/wp-content/uploads/2024/10/Arrival_info_Pack_2024_WUT.pdf",Accommodation & Housing,https://sspw.pl/wp-content/uploads/2024/10/Arrival_info_Pack_2024_WUT.pdf
