question,answer,category,language,source_type,source_url,base_pattern_source,methodology
Jakie stypendia są dostępne dla studentów?,"Politechnika Warszawska oferuje kilka rodzajów stypendiów: (1) Stypendium socjalne dla studentów, których dochód na członka rodziny nie przekracza 1570,50 PLN, (2) Stypendium socjalne w zwiększonej wysokości w szczególnych przypadkach, (3) Stypendium dla osób niepełnosprawnych (bez względu na dochód rodziny), (4) Stypendium Rektora dla studentów z wysokimi osiągnięciami akademickimi (średnia 4.0 i wyżej), osiągnięciami naukowymi/artystycznymi lub zwycięzcami konkursów, (5) Pomoc materialna dla studentów w trudnej sytuacji życiowej. Studenci zagraniczni mogą również ubiegać się o stypendia Erasmus+ i inne stypendia rządowe.",Scholarships,pl,WUT_official_website,https://www.il.pw.edu.pl/wp-content/uploads/2024/10/Scholarship-Guide-2024-2025.pdf,University FAQ common patterns,"Translation of common FAQ to Polish, answer from WUT official sources"
Kiedy jest termin egzaminacyjny?,"Terminy egzaminacyjne na PW to: (1) Zimowa sesja egzaminacyjna: rozpoczyna się 2 lutego 2026, (2) Letnia sesja egzaminacyjna: rozpoczyna się 17 czerwca 2026 i kończy 30 czerwca 2026, (3) Jesienna sesja egzaminacyjna: rozpoczyna się 1 września 2026 i kończy 15 września 2026. Jesienna sesja jest przeznaczona wyłącznie na poprawki.",Exams,pl,WUT_official_website,https://erasmus.pw.edu.pl/erasmusen/Incoming-Students/Academic-calendar,University FAQ common patterns,"Translation of common FAQ to Polish, answer from WUT official sources"
Kiedy rozpoczyna się rok akademicki?,Rok akademicki 2025/2026 na Politechnice Warszawskiej rozpoczyna się 01.10.2025 (środa) uroczystą inauguracją roku akademickiego. Ta data oznacza oficjalny start nowego roku akademickiego.,Academic_Calendar,pl,WUT_official_website,https://erasmus.pw.edu.pl/erasmusen/Incoming-Students/Academic-calendar,University FAQ common patterns,"Translation of common FAQ to Polish, answer from WUT official sources"
Jak mogę aplikować na wymianę Erasmus?,"Aby zostać przyjętym na wymianę Erasmus+ na Politechnice Warszawskiej, musisz: (1) być studentem uniwersytetu partnerskiego, który podpisał umowę międzyinstytucjonalną Erasmus+ z jednym z wydziałów PW, (2) zostać nominowanym przez swoją uczelnię macierzystą przed aplikacją, (3) wypełnić aplikację online przez system IRK. Nie możesz zarejestrować się samodzielnie - najpierw musisz zostać nominowany przez koordynatora Erasmus w swojej uczelni macierzystej.",Erasmus,pl,WUT_official_website,https://erasmus.pw.edu.pl/erasmusen/Incoming-Students,University FAQ common patterns,"Translation of common FAQ to Polish, answer from WUT official sources"
Co to jest USOSweb?,"USOSweb to oficjalny system studencki na PW, który zawiera plan zajęć i egzaminów, przypisanie sal, oceny oraz rejestrację na przedmioty. Dostęp do USOSweb otrzymasz dopiero po oficjalnym przyjęciu na uczelnię. Istnieje również aplikacja mobilna MyUSOSweb, którą możesz pobrać, aby korzystać z systemu na telefonie.",Campus_Life,pl,WUT_official_website,https://bwz.uw.edu.pl/en/frequently-asked-questions/,University FAQ common patterns,"Translation of common FAQ to Polish, answer from WUT official sources"
